Company Name,Year_Funded,Founded_in,Industry,Round/Series,Amount,Revenue,Location,About Company,Investors
TheCollegeFever,2018,2017.0,"Brand Marketing, Event Promotion, Marketing, Sponsorship, Ticketing",Seed,250000.0,644387.9133943800,"Bengaluru, Karnataka, India","TheCollegeFever is a hub for fun, fiesta and frolic of Colleges.",Unknown
Happy Cow Dairy,2018,2017.0,"Agriculture, Farming",Seed,470588.24,2185141.040110250,"Mumbai, Maharashtra, India",A startup which aggregates milk from dairy farmers in rural Maharashtra.,Unknown
MyLoanCare,2018,2017.0,"Credit, Financial Services, Lending, Marketplace",Series A,764705.88,1547895.5343354400,"Gurgaon, Haryana, India",Leading Online Loans Marketplace in India,Unknown
PayMe India,2018,2017.0,"Financial Services, FinTech",Angel,23529.41,74336.7863433952,"Noida, Uttar Pradesh, India",PayMe India is an innovative FinTech organization which offers short term financial suport to corporate employees.,Unknown
Hasura,2018,2017.0,"Cloud Infrastructure, PaaS, SaaS",Seed,18823.53,52779.689395323200,"Bengaluru, Karnataka, India","Hasura is a platform that allows developers to build, deploy, and host cloud-native applications quickly.",Unknown
Tripshelf,2018,2017.0,"Internet, Leisure, Marketplace",Seed,188235.29,788511.4403394010,"Kalkaji, Delhi, India",Tripshelf is an online market place for holiday packages.,Unknown
Hyperdata.IO,2018,2017.0,Market Research,Angel,588235.29,1284011.4649912000,"Hyderabad, Andhra Pradesh, India",Hyperdata combines advanced machine learning with human intelligence.,Unknown
Freightwalla,2018,2017.0,"Information Services, Information Technology",Seed,323398839173535.44,553386633291270.3,"Mumbai, Maharashtra, India",Freightwalla is an international forwarder thats helps you manage supply chain by providing online tools including instant quotations.,Unknown
Microchip Payments,2018,2017.0,Mobile Payments,Seed,323398839173535.44,937559862383995.4,"Bengaluru, Karnataka, India",Microchip payments is a mobile-based payment application and point-of-sale device,Unknown
BizCrum Infotech Pvt. Ltd.,2018,2017.0,"B2B, Shoes",Seed,323398839173535.44,643080794115586.5,"Delhi, Delhi, India",Building Transactionary B2B Marketplaces,Unknown
Emojifi,2018,2017.0,Internet,Seed,323398839173535.44,1545045848049912.0,"Bengaluru, Karnataka, India","Emojifi is an app that provides live emoji, stickers & GIFs suggestions based on the typed words across chat platforms.",Unknown
Flock,2018,2017.0,"Apps, Collaboration, Developer Platform, Enterprise Software, Messaging, Productivity Tools, Video Chat",Seed,323398839173535.44,1112939611038066.1,"India, Asia",Flock is a real-time messaging and collaboration app for teams that speeds up and simplifies communication and boosts productivity.,Unknown
Freshboxx,2018,2017.0,Food Delivery,Seed,323398839173535.44,909025555984882.6,"Hubli, Karnataka, India","Freshboxx is incubated at Sandbox Startups, a unit of the Deshpande Foundation.",Unknown
Wide Mobility Mechatronics,2018,2017.0,Industrial Automation,Seed,323398839173535.44,1299368458969363.0,"Bengaluru, Karnataka, India",Wide Mobility Mechatronics is a Private Company limited by Shares,Unknown
Pitstop,2018,2017.0,"Automotive, Search Engine, Service Industry",Seed,1176470.59,1863563.9235120900,"Bengaluru, Karnataka, India",Pitstop offers general repair and maintenance services for cars through its doorstep service vehicles.,Unknown
Mihuru,2018,2017.0,"Finance, Internet, Travel",Seed,1764.71,7016.975868210590,"Mumbai, Maharashtra, India",Mihuru is an online platform which gives micro loans for air travel .,Unknown
Fyle,2018,2017.0,"Accounting, Business Information Systems, Business Travel, Finance, SaaS",Seed,12941.18,48166.87263675270,"Bengaluru, Karnataka, India",Fyle is an intelligent expense management platform for enterprises.,Unknown
AppWharf,2018,2017.0,"Artificial Intelligence, Product Search, SaaS, Service Industry, Software",Seed,12941.18,46147.84068362870,"New Delhi, Delhi, India",Appwharf is an intelligent assistant that helps find you the best-fit SaaS for your business.,Unknown
Antariksh Waste Ventures Pvt ltd,2018,2017.0,"Internet of Things, Waste Management",Seed,5882.35,14198.86906110170,"Chennai, Tamil Nadu, India",Waste Management for Smart Cities,Unknown
PaisaDukan,2018,2017.0,Financial Services,Seed,7647.06,34398.63246974210,"Mumbai, Maharashtra, India",A P2P lending marketplace platform,Unknown
Sleepy Owl Coffee,2018,2017.0,Food and Beverage,Seed,411764.71,1678250.5013633300,"New Delhi, Delhi, India","Makers of a signature coffee that's exceptional in taste. It's super easy to brew, requires no equipment & ships to your door.",Unknown
BlueJack,2018,2017.0,Autonomous Vehicles,Seed,752941.18,3493702.9817927000,"Delhi, Delhi, India",Delhi-based online used vehicles marketplace.,Unknown
PregBuddy,2018,2017.0,"Enterprise Software, Health Care, Hospital, Parenting, Personal Health, SaaS",Seed,323398839173535.44,1440212413717870.8,"Bengaluru, Karnataka, India",PregBuddy is a smart connected care platform for expecting mothers.,Unknown
AgNext Technologies,2018,2017.0,"Agriculture, Analytics, Big Data, Farming",Series A,323398839173535.44,1080701658439256.5,"Mohali, Punjab, India",AgNext is an agricultural sensing and solutions company focused on building data-driven solutions for agricultural stakeholders,Unknown
Mintifi,2018,2017.0,"Financial Services, Lending",Seed,23529.41,98744.24130524350,"Mumbai, Maharashtra, India",Online lending startup based in Mumbai.,Unknown
Carcrew,2018,2017.0,"Automotive, Marketplace, Online Portals",Seed,23529.41,44044.84533749300,"Mumbai, Maharashtra, India",India's Online Auto Repair Marketplace,Unknown
NicheAI,2018,2017.0,Artificial Intelligence,Angel,235294.12,1145409.4548654000,"Hyderabad, Andhra Pradesh, India",Early stage Artificial Intelligence (AI) start up.,Unknown
Chariot Tech,2018,2017.0,"Internet of Things, Telecommunications",Seed,235294.12,746105.0144991770,"New Delhi, Delhi, India",Chariot Tech is an Internet of Things (IoT) startup based in New Delhi.,Unknown
Ideal Insurance Brokers/ 121Policy.com,2018,2017.0,Insurance,Seed,1000000.0,4756134.3468162000,"Kolkata, West Bengal, India",Ideal Insurance Broking is one of the leaders in insurance broking domain.,Unknown
Loanzen,2018,2017.0,Financial Services,Seed,323398839173535.44,1341545315689898.2,"Bengaluru, Karnataka, India",Loanzen helps small businesses get unsecured working capital loans against their their pending invoices.,Unknown
Mojro Technologies,2018,2017.0,"Information Technology, Logistics, Supply Chain Management",Seed,7647.06,25525.73147282550,"Bengaluru, Karnataka, India",Mojro envisions to be the world's largest technology-enabled logistics platform.,Unknown
Elemential,2018,2017.0,"Blockchain, Developer Tools, Enterprise Software",Seed,11764.71,38879.383959989100,"Mumbai, Maharashtra, India","Blockchain Development Platform To Design, Run & Scale Blockchain Networks.",Unknown
Yumlane,2018,2017.0,"Food and Beverage, Food Delivery, Snack Food",Series A,47058.82,133105.9364172940,"Mumbai, Maharashtra, India",Food startup Yumlane operated by QwikPik Technology,Unknown
Kriger Campus,2018,2017.0,Education,Seed,352941.18,1032856.9497514500,"New Delhi, Delhi, India",A Education Start Up.,Unknown
Kaleidofin,2018,2017.0,Financial Services,Seed,32941.18,72272.01270773140,"Chennai, Tamil Nadu, India",A fintech platform.,Unknown
Chakr Innovation,2018,2017.0,Renewable Energy,Seed,323398839173535.44,1129215331869371.8,"New Delhi, Delhi, India",Chakr has developed the world’s first retro-fit emission control device for diesel generators.,Unknown
IndigoLearn,2018,2017.0,"E-Learning, Education",Seed,1764.71,6480.601863786980,"Hyderabad, Andhra Pradesh, India",India's the premier education destination catering to the needs of aspiring students of the CA community.,Unknown
UClean,2018,2017.0,"Clean Energy, CleanTech, Laundry and Dry-cleaning",Seed,470588.24,1087652.1145361200,"India, Asia",UClean is a tech enabled laundry service provider.,Unknown
Coutloot,2018,2017.0,"E-Commerce, Fashion, Mobile",Seed,11764.71,22046.63636375200,"Mumbai, Maharashtra, India",The Fashion Re-commerce platform.,Unknown
Letstrack,2018,2017.0,"Apps, Messaging, Navigation, Public Safety",Seed,20000.0,68134.52127648890,"New Delhi, Delhi, India","Letstrack GPS tracking devices to track your kids, bike, car and other vehicles. GPS trackers for Vehicle Tracking System in India.",Unknown
Pooltoo,2018,2017.0,Transportation,Seed,323398839173535.44,822006821260556.9,"New Delhi, Delhi, India",Pooltoo offers a premium ride sharing platform.,Unknown
Finzy,2018,2017.0,"Financial Services, Lending",Seed,15294.12,53259.774127067000,"Bengaluru, Karnataka, India",finzy is the premier peer to peer lending solution in India.,Unknown
Fitternity,2018,2017.0,"Fitness, Health Care, Wellness",Seed,23529.41,112272.201404382,"Mumbai, Maharashtra, India",India's largest online fitness platform that provides an integrated eco-system to help users start & sustain their fitness journey,Unknown
Keito,2018,2017.0,"Artificial Intelligence, Machine Learning, SaaS, Virtual Assistant",Seed,323398839173535.44,1511431848671923.0,"Pune, Maharashtra, India",Building an Intelligent Digital Assistant.,Unknown
Tolet for Students,2018,2017.0,Hospitality,Seed,58823.53,168415.9548535320,"Jodhpur, Rajasthan, India","Reserve your Room, Hostel or Paying Guest, while relocating for higher education.",Unknown
Chai Kings,2018,2017.0,"Food and Beverage, Tea",Seed,235294.12,450211.5899541890,"Chennai, Tamil Nadu, India",Chai Kings is a tea retail chain,Unknown
ONGO Framework,2018,2017.0,"B2B, Information Services, Information Technology",Angel,11764.71,34724.94330112520,"Hyderabad, Andhra Pradesh, India",ONGO Framework is a B2B IT and digital solution provider.,Unknown
Notesgen,2018,2017.0,"EdTech, Education, Enterprise Software, Peer to Peer",Seed,147058.82,667469.556649415,"New Delhi, Delhi, India",A Global Peer-to-Peer and Peer-to-Group Learning Platform that helps students supplement their academic & competitive exam prep.,Unknown
Arogya MedTech,2018,2017.0,"Health Care, Medical",Seed,176470.59,588481.7304934930,"Kolkata, West Bengal, India",Arogya MedTech is a Research & Development organization in Bio-Medical industry.,Unknown
Propshop24,2018,2017.0,E-Commerce,Seed,5882.35,19603.618291645400,"Mumbai, Maharashtra, India","Propshop24, a one-stop shop for a handpicked selection of 'fun'tastic products from around the world.",Unknown
myUpchar,2018,2017.0,"Health Care, Hospital, Wellness",Series A,58823.53,175745.40283524300,"New Delhi, Delhi, India",To bring health issues to people in their language.,Unknown
MissMalini Entertainment,2018,2017.0,—,Seed,1223529.41,5344894.806877460,"Mumbai, Maharashtra, India","MissMalini Entertainment is a multi-platform new media network dedicated to Entertaining, Connecting & Empowering young Indians.",Unknown
Rooter,2018,2017.0,Sports,Seed,529411.76,824715.0351060770,"India, Asia",Rooter is a mobile-based platform,Unknown
ZestMoney,2018,2017.0,"Big Data, Consumer Lending, FinTech",Series A,157647.06,672046.8502318540,"Bengaluru, Karnataka, India",Zest is India's first completely automated consumer digital lending platform.,Unknown
alphaics Corporation,2018,2017.0,"Cloud Computing, Computer, Semiconductor",Seed,323398839173535.44,616886744457788.2,"Bengaluru, Karnataka, India",Advancing AI compute,Unknown
MyDentistChoice,2018,2017.0,"Health Care, Medical, Pharmaceutical",Seed,5882.35,27530.138925471200,"Hyderabad, Andhra Pradesh, India",MyDentistChoice is a direct sales and distribution of dental equipment and accessories from top name manufacturers,Unknown
Sensibull,2018,2014.0,Trading Platform,Seed,294117.65,738745.5759562130,"Bengaluru, Karnataka, India",Investment Management Platform,Unknown
Bombay Shaving Company,2018,2017.0,"Consumer Goods, Lifestyle, Men's",Series A,323398839173535.44,1580114544261087.8,"New Delhi, Delhi, India",Bombay Shaving Company is a Men's grooming startup,Unknown
MedCords,2018,2014.0,Wellness,Seed,310588.24,1456262.6480867800,"Pune, Maharashtra, India",Medcords is India’s first holistic healthcare ecosystem on a cloud platform that makes health management easier,Unknown
University Living,2018,2017.0,Education,Seed,323398839173535.44,1468262918295465.0,"New Delhi, Delhi, India",University Living is an online global student housing marketplace.,Unknown
&ME,2018,2014.0,"Food and Beverage, Food Processing, Nutrition",Seed,323398839173535.44,1502710034352841.5,"Bengaluru, Karnataka, India",Food and Beverage startup focussing on developing products using ayurveda with modern science for women empowerment and fitness.,Unknown
Enakshi,2018,2004.0,Fashion,Seed,94117.65,402371.68903010500,"Ahmedabad, Gujarat, India",Enakshi is an online apparel brand for women.,Unknown
Ultraviolette Automotive,2018,2017.0,"Automotive, Electric Vehicle, Energy Storage",Series A,705.88,1202.7905808383400,"Bengaluru, Karnataka, India",Ultraviolette is a startup working on electric two-wheelers and energy infrastructure.,Unknown
BUGWORKS Research India,2018,2013.0,"Biotechnology, Life Science, Pharmaceutical, Product Research",Series A,105882.35,391460.39517835300,"Bengaluru, Karnataka, India",BUGWORKS is a drug discovery company.,Unknown
Guardian.in,2018,2017.0,Health Care,Seed,323398839173535.44,1582289850797203.8,"Mumbai, Maharashtra, India",GNC is a leading global specialty retailer of health and wellness products that takes pride to be the world's largest company,Unknown
PrestLoans,2018,2010.0,"Credit, Financial Services, FinTech, Personal Finance",Seed,1176.47,3845.4925608656100,"New Delhi, Delhi, India","PrestLoans New age tech driven RBI regd NBFC helping businesses by providing easy, quick n hassle free loans.",Unknown
Wimoxez,2018,2010.0,Internet,Seed,235.29,450.6155445883500,"Hyderabad, Andhra Pradesh, India","Data Intelligence Publishing Platform, We bring the best resources to learn valuable technologies which will shape tomorrow.",Unknown
India Accelerator,2018,2017.0,"Communities, Coworking, Incubators",Angel,323398839173535.44,831439873510163.6,"Gurgaon, Haryana, India",India Accelerator runs mentorship-driven incubation and acceleration programs for start ups.,Unknown
HappyEMI,2018,2018.0,"Consumer, Financial Services, FinTech",Seed,11764.71,31010.956596687700,"Bengaluru, Karnataka, India",HappyEMI is a point of sale digital lending platform that helps consumers finance their purchases in-store and online,Unknown
Wishup,2018,2019.0,"Consumer Applications, Information Services, Location Based Services, Virtual Assistant",Seed,323398839173535.44,1462153371907747.0,"Azadpur, Delhi, India",Premium Personal Assistance service,Unknown
Hansel.io,2018,2017.0,"Mobile, Mobile Apps, Personalization, Test and Measurement, Web Apps",Series A,47058.82,184416.2301240770,"Bengaluru, Karnataka, India","Hansel, a mobile app management platform, provides the infrastructure that companies need, in order to personalize product experiences.",Unknown
Propelld,2018,2017.0,"Education, Financial Services, FinTech",Seed,2941.18,6183.66796972718,"Bengaluru, Karnataka, India",Propelld is a student education financing platform.,Unknown
PivotRoots,2018,2011.0,"Advertising, Consulting, Digital Marketing",Series A,323398839173535.44,499209076734232.9,"Mumbai, Maharashtra, India",Digital Marketing powered by Data & Technology; fueled by Design thinking,Unknown
ZiffyHomes,2018,2015.0,"Marketplace, Real Estate, Rental Property",Seed,1411.76,3069.2320779104600,"New Delhi, Delhi, India",ZiffyHomes is a technology driven marketplace to find out home on rent.,Unknown
Carmesi,2018,2014.0,Health Care,Seed,400000.0,1225344.9329642000,"Gurgaon, Haryana, India",Carmesi is a brand of high-end menstrual-hygiene products in India.,Unknown
OckyPocky,2018,2018.0,"E-Learning, Internet, Video Games",Angel,323398839173535.44,901182267142896.4,"Haryana, Haryana, India",OckyPocky is a interactive and personalised language learning app for preschool kids.,Unknown
Racetrack,2018,2015.0,"Artificial Intelligence, Cloud Computing, Video",Seed,4023529.41,9107618.301263900,"Bengaluru, Karnataka, India","Racetrack is a sales and support-focused AI-driven platform designed for education, real estate, and e-commerce sectors.",Unknown
WHR,2018,2018.0,"Health Care, Information Technology",Seed,1684.06,6334.193939784450,"Pune, Maharashtra, India","WHR is to make affordable healthcare a reality for all. Our vision is to make healthcare services easier, better and more accessible.",Unknown
Asteria Aerospace,2018,2013.0,Aerospace,Seed,323398839173535.44,1175234879086628.5,"Bengaluru, Karnataka, India",Asteria Aerospace is a robotics and artificial intelligence company.,Unknown
FabAlley,2018,2018.0,"E-Commerce, Fashion, Lifestyle",Series B,7058823.53,23571882.883910300,"Noida, Uttar Pradesh, India","FabAlley is the ultimate Indian fashion destination for fashion-forward, indie-chic girls. Founded in 2012, Tanvi Malik and Shivani Poddar",Unknown
Tranzmeo,2018,2014.0,"Artificial Intelligence, Business Intelligence, Industrial Automation, Machine Learning",Pre-Seed,323398839173535.44,1382647988446439.5,"Cochin, Kerala, India",Tranzmeo Connect : is A Complete Comprehensive Anomaly forensic Solution with Actionable Insights.,Unknown
SBI Life,2018,2019.0,Insurance,Private Equity,8729411.76,20497247.60703540,"Mumbai, Maharashtra, India",SBI Life is one of the life insurance company that offers a range of life insurance plans and policies to protect you and your family.,Unknown
Studds Accessories,2018,2017.0,E-Commerce,Private Equity,11764705.88,55399869.92391510,"Faridabad, Haryana, India",Studds Accessories is a scooter accessories service provider in India,Unknown
Design Cafe,2018,2017.0,"Home Decor, Home Improvement, Home Renovation, Home Services, Interior Design, Smart Home",Series B,23529411.76,93343842.3950271,"Bengaluru, Karnataka, India","Design + Execution Organization that delivers beautiful & innovative designs for Home Interiors, in any budget.",Unknown
NoPaperForms Solutions Pvt. Ltd.,2018,2015.0,"EdTech, Education, Information Services, SaaS",Series B,46823.53,234000.54027235000,"New Delhi, Delhi, India","NoPaperForms is a marketing automation, lead nurture and enrolment management platform for educational institutions",Unknown
Rays Power Infra,2018,2019.0,"Energy, Solar",Venture - Series Unknown,23529411.76,40455207.43593660,"Jaipur, Rajasthan, India",Rays Power Infra is a leading integrated Solar Power Company.,Unknown
AuthMetrik,2018,2017.0,"B2B, Biometrics, Cyber Security, Fraud Detection, SaaS, Security",Grant,117.65,221.01975934383700,"Gurgaon, Haryana, India","SaaS, B2B, Security, Stop account sharing, Fraud Detection",Unknown
Khidki,2018,2017.0,"Artificial Intelligence, Social",Seed,323398839173535.44,509106114252169.75,"Bengaluru, Karnataka, India",Vernacular Social Network Focused on Town Level Content and Interactions,Unknown
LetsTransport,2018,2014.0,"Logistics, Transportation, Travel",Series B,11764705.88,26400435.279583100,"Bengaluru, Karnataka, India",Lets transport is a logistics solution provider.,Unknown
Next Digital Solutions,2018,2011.0,"Digital Marketing, SEM, SEO, Web Development",Angel,1176.47,5236.569220847550,"Kota, Rajasthan, India",Next Digital Solutions is website design & Digital Marketing development company.,Unknown
Portea Medical,2018,2014.0,"Health Care, Hospital, Medical",Debt Financing,2941176.47,11982376.931595900,"Bengaluru, Karnataka, India",Portea Medical is the largest and fastest growing provider of in-home medical care in India today with a 24-city network.,Unknown
Aavas Financiers,2018,2017.0,"Finance, Financial Services",Post-IPO Debt,23529411.76,39762101.03699900,"Jaipur, Rajasthan, India","Aavas Financiers is engaged in the business of providing housing loans, primarily in the un-served, unreached and under-served market.",Unknown
Swiggy,2018,2018.0,"Food Delivery, Food Processing, Internet",Series H,11764705.88,31811801.38767220,"Bengaluru, Karnataka, India",Swiggy is a food ordering and delivery company that provides food service solutions for restaurants.,Unknown
Milkbasket,2018,2017.0,"E-Commerce, Food and Beverage, Internet",Series A,82352.94,252909.6479472930,"Haryana, Haryana, India","Milkbasket delivers milk, bread, eggs, butter, juices and other daily need items, every morning, right at your doorstep, free of charge.",Unknown
Nutrisattva (Proliva),2018,2016.0,"Fitness, Food and Beverage, Health Care, Nutrition",Angel,323398839173535.44,1149992726317608.8,"Anand, Gujarat, India",Nutrisattva is a protein innovation compan,Unknown
Toppr,2018,2013.0,"EdTech, Education, Knowledge Management",Series C,411764.71,667440.5828311960,"Mumbai, Maharashtra, India",Toppr.com is an online preparation platform for entrance exams in India.,Unknown
Vivriti Capital,2018,2015.0,Financial Services,Venture - Series Unknown,335294.12,1518624.8151693300,"Chennai, Tamil Nadu, India",Vivriti Capital is an online platform for institutional debt in India.,Unknown
Impact Guru,2018,2016.0,"Creative Agency, Crowdfunding, EdTech, Health Care, Internet, Medical, Non Profit, Personal Health",Series A,23529.41,78038.04466275360,"Mumbai, Maharashtra, India","We're a Harvard incubated crowdfunding platform for nonprofits, social enterprises, startups and individuals.",Unknown
MobiKwik,2018,2014.0,"Consumer Lending, Financial Services, FinTech, Insurance, Lending, Mobile Payments, Payments, Wealth Management",Series E,2823529.41,10831613.141430800,"Gurgaon, Haryana, India",MobiKwik is a payments backed fintech platform in India. MobiKwik App offers instant loans & investment products to the 500M masses of India,Unknown
Stones2Milestones,2018,2014.0,"E-Learning, Education, Higher Education",Seed,323398839173535.44,1399157918897152.5,"Gurgaon, Haryana, India",Stones2milestones is a Gurgaon Based Learning Company.,Unknown
Generico,2018,2015.0,"Health Care, Medical, Pharmaceutical",Series A,323398839173535.44,1221133108781278.0,"Mumbai, Maharashtra, India",Generico is the fastest growing specialized pharmacy retail chain of Generic medicines.,Unknown
Adiuvo Diagnostics,2018,2016.0,Health Diagnostics,Seed,323398839173535.44,1002291293575065.9,"Chennai, Tamil Nadu, India",Adiuvo Diagnostics is a medical diagnostic device company based in India.,Unknown
DataTrained,2018,2011.0,"EdTech, Education",Seed,1411764.71,3076539.453997500,"Bengaluru, Karnataka, India","DataTrained is a educational platform, which operates an ed-tech startup on data science",Unknown
OneAssist,2018,2016.0,"Financial Services, SaaS, Security",Debt Financing,28235.29,111142.21356764300,"Mumbai, Maharashtra, India",OneAssist is a protection & assistance services platform.,Unknown
Satin Creditcare Network Limited (SCNL),2018,2012.0,"Banking, Finance, Financial Services, Non Profit",Post-IPO Debt,352941.18,859091.7923355970,"New Delhi, Delhi, India",Satin is a non-banking finance company providing individual loans to urban shopkeepers.,Unknown
APAC Financial Services,2018,2017.0,"Finance, Financial Services",Private Equity,29411764.71,55422441.42553440,"Mumbai, Maharashtra, India",APAC Financial Services is a financial services platform.,Unknown
Moglix,2018,2016.0,"B2B, E-Commerce, Mobile",Series C,270588.24,928793.960876195,"Noida, Uttar Pradesh, India","Moglix is a supplier of industrial tools like hand tools, power tools, electrical, and safety equipment.",Unknown
SEDEMAC Mechatronics,2018,2015.0,"Automotive, Electric Vehicle, Renewable Energy",Venture - Series Unknown,323398839173535.44,1377847956468637.5,"Mumbai, Maharashtra, India",SEDEMAC Mechatronics is technology company that distributes control-intensive products for automobiles.,Unknown
MadGuy Labs,2018,2015.0,E-Learning,Venture - Series Unknown,1764.71,5131.654320409390,"Hyderabad, Andhra Pradesh, India",MadGuy Labs is a Online Test-prep Platform.,Unknown
Dee Dee Labs,2018,2014.0,"Embedded Systems, Health Care, Medical, Product Research",Seed,323398839173535.44,1044009791259099.0,"Pune, Maharashtra, India",Dee Dee Labs is design and development lab with a primary focus on the development of next generation of bionic prostheses.,Unknown
Shop101,2018,2017.0,"Apps, E-Commerce, Internet",Series B,129411.76,228040.8647435710,"Mumbai, Maharashtra, India",#1 Online Selling App. India’s leading social commerce platform. Setup free online store in 2 min. Sell own goods or resell Shop101 Supply.,Unknown
FeedMyPockets,2018,2010.0,"Advertising, Human Resources, Marketing",Seed,517647.06,1456625.3036770200,"Bengaluru City, Karnataka, India",On Demand Staffing Platform,Unknown
Housejoy,2018,2017.0,"Beauty, Fitness, Home Services, Internet",Series B,38117.65,177086.80391030900,"Bengaluru, Karnataka, India",Housejoy is a web-based platform that allows individuals to browse and book service providers for their homes.,Unknown
Ambee,2018,2012.0,"Health Care, Medical Device, Public Safety",Angel,323398839173535.44,1571231681319808.8,"Bengaluru, Karnataka, India",Ambee is an Environment analytics startup.,Unknown
FoodBuddy,2018,2017.0,"Food Delivery, Online Portals, Restaurants",Seed,705882.35,3388003.761902410,"Belgaum, Karnataka, India","FoodBuddy is a online food delivery portal, providing boundary breaking delivery.",Unknown
Olly Smart Credit Card,2018,2017.0,"Credit Cards, Finance, Mobile Apps, Mobile Payments, Payments",Seed,323398839173535.44,1370404221991426.8,"New Delhi, Delhi, India",Olly is a digital credit card for India's working masses and young people.,Unknown
Zestl,2018,2017.0,Software,Seed,323398839173535.44,1543438333188259.8,"Pune, Maharashtra, India","No-Code Workflow Automation. Build enterprise applications in days with AI, Cognitive Automation, Collaboration and more built in.",Unknown
