Company Name,Year_Funded,Founded_in,Industry,Round/Series,Amount,Revenue,Location,About Company,Investors
Xpressbees,2020,2019.0,E-commerce,Unknown,1176470.59,3183725.458339970,Pune,Xpressbees is an e-commerce logistics company that provides reliable logistics solutions to its partners.,"Alibaba Group, InnoVen Capital"
GalaxyCard,2020,2017.0,FinTech,Seed,323398839173535.44,842298771689598.1,Gurugram,Mobile based Instant credit card. | Easiest way to get a credit card. Get one in 3 minutes,India Accelerator
Wellness Forever,2020,2012.0,HealthTech,Unknown,1176470.59,2782155.5831920200,Mumbai,Wellness Forever is the one-stop destination for wellness,"Poonawalla, Allana Group"
MoooFarm,2020,2011.0,AgriTech,Pre-seed,5882.35,28730.60307584400,Gurugram,MoooFarm is an information technology company that bridges the technology gap to help marginalized dairy farmers.,"Navus Ventures, Rockstart"
BitClass,2020,2016.0,PaaS startup,Seed,23529.41,112160.30933164900,Bengaluru,BitClass is a PaaS solution which helps teachers set up their independent live classes,"AET Japan, Figure Eight Investments, Waterbridge Ventures"
Gonuts,2020,2017.0,Entertainment,Seed,4705.88,22627.88464112630,Mumbai,Personalised Video shoutouts from favourite celebrity.,"Sweta Rau, Archana Priyadarshini"
Uolo,2020,2011.0,EdTech,Seed,23529.41,76140.89528336540,Bengaluru,Uolo Technology is founded by paranoid parents who want to make a difference to preschool experience.,"Rajul Garg, Purvi Capital"
Kirana King,2020,2016.0,Retail,Pre-series A,10588.24,49910.812107355100,"Jaipur, Rajastan","A revolutionary idea of standardization, digitization & centralization to traditional Grocery system.",Rajasthan Venture Capital Fund
Jade Forest,2020,2014.0,Beverages,Seed,2941.18,6248.9025738017700,Delhi,"NATURALLY THE BEST From zero artificial ingredients in our drinks to the way they make you feel, we bring you a bespoke range of natural mixers.",Unknown
iKure,2020,2016.0,HealthTech,Unknown,323398839173535.44,545635602159110.8,Kolkata,iKure is a social enterprise that delivers primary healthcare and wellness & prevention services to communities in India,"Ratan Tata, Inflection Point Ventures, Ankur Mittal"
FrontRow,2020,2012.0,EdTech,Seed,37647.06,169382.2166076960,Bengaluru,"Comprehensive courses, taught by idols.","Lightspeed, Elevation, Deepika Padukone"
Reliance Retail,2020,2017.0,E-commerce,Unknown,117647.06,498624.63332866800,Mumbai,Reliance Retail Ventures Limited is a subsidiary company of Reliance Industries Limited.,"Abu Dhabi Investment Authority, GIC"
TUBBR,2020,2015.0,Social Media,Unknown,323398839173535.44,1034136182470114.1,"Frisco, Texas, United States",World's First Personal Social Network,Global Ascent Partners
Ather Energy,2020,2018.0,Automobiles,Series D,411764.71,1683134.1073850300,Bengaluru,Ather Energy is a manufacturer of electric scooters.,HeroMotoCorp Ltd and Sachin Bansal
Routematic,2020,2016.0,SaaS startup,Unknown,23529.41,89576.19410296510,Bengaluru,Vision is to enable a safer and more comfortable commute to work for employees of India Inc.,"VAMM Ventures, Naresh Malhotra"
LivFin,2020,2009.0,FinTech,Unknown,55294.12,198884.95673343300,New Delhi,LivFin is a non-banking financial company registered with the Reserve Bank of India (RBI),"DEG, KFW DEG"
Universal Sportsbiz Pvt Ltd,2020,2015.0,Fashion startup,Unknown,323398839173535.44,780318183124510.0,Bengaluru,A fashion startup based in Bengaluru.,"Accel, Alteria Capital"
Lattu Kids,2020,2017.0,EdTech,Unknown,323398839173535.44,782057177711612.5,Mumbai,Lattu kids is an edutainment platform for preschool kids.,Mumbai Angels Network
Eggoz,2020,2019.0,Food & Bevarages,Pre-series A,17647.06,45253.78880303410,Indore,"Eggoz is a brand of fresh and chemical-free eggs, produced in tech-enabled & nutrition-engineered deep integration partnership with farmers.","AVANA Capital, Rebright Partners"
Steradian Semiconductors,2020,2017.0,Deeptech,Unknown,323398839173535.44,1343757872799861.0,Bengaluru,Semiconductor company focused on CMOS millimeter wave products for Radar.,Endiya Partners.
CHARGE+ZONE,2020,2020.0,EV startup,Pre-series A,35294.12,74679.39274213240,Gujarat,"Charge+Zone provides services in renewable energy solutions, product development, and software engineering company.",Mumbai Angels
Stones2milestones,2020,2017.0,EdTech,Bridge,23529.41,94537.06762938960,Gurugram,Stones2milestones is India (Delhi) Based EdTech Company,"Menterra Venture Advisors, Emandi Sankara Rao"
Udacity,2020,2017.0,EdTech,Debt,882352.94,1333364.457559080,California,"Udacity develops an online learning platform offering programs in artificial intelligence, machine learning, and robotics sector.","Hercules Capital, Inc.Bertelsmann"
AjnaLens,2020,2017.0,AR/VR startup,Bridge,11764.71,56933.4661980682,Thane,"AjnaLens develops AR/VR wearables primarily for the Defence, Education and enterprise customers.","Mohsin Hani Al Bahrani, MoD"
Gully Network,2020,2015.0,E-commerce,Pre-series A,14117.65,57854.32230419200,Bengaluru,Gully Network is a tech-enabled network of mid-sized grocery stores.,"CP Ventures, Orios Venture Partners"
TurboHire,2020,2017.0,Recruitment startup,Seed,11764.71,48333.335912045500,Hyderabad,Talent Intelligence Platform for enterprises that helps recruiters discover the right candidates for a job using a Human-like AI,"Kia Ora Ventures, Pentathlon Ventures"
Traya,2020,2015.0,HealthTech,Seed,323398839173535.44,1528034143274919.8,Mumbai,work with our customers closely to get their hair health sorted for long-term effective results,"Kae Capital, Whiteboard Capital"
Charcoal Eats,2020,2017.0,QSR startup,Unknown,23529.41,77907.51965506630,Mumbai,"In the last five years, have served over 1.5 million orders and enjoy high customer satisfaction.",Lokmat Investments
Mitron TV,2020,2017.0,Video platform,Unknown,323398839173535.44,945372311107328.0,Bengaluru,Mitron is a free short videoplatform for next generation,9Unicorns
Svami,2020,2017.0,Food & Bevarages,Unknown,9411.76,27507.635204459800,Mumbai,Svami is the result of three seasoned drinkers extending their love for libations to the larger world of drinks.,"Niren Shah, Rukam Capital Trust"
Dhurnia,2020,2017.0,EdTech,Unknown,1176.47,2908.6023136768500,"Dhingsara, Haryana",Developer of an online learning platform intended for various competitive exam preparations.,"Chandigarh Angels Network, Modulor Capital"
Expertrons,2020,2002.0,EdTech,Unknown,323398839173535.44,632456462039277.8,Mumbai,Expertrons is an AI video bot platform created to help students and professionals prepare for interviews.,"Rohit Chanana, Sukanta Ganguly"
Leena AI,2020,2018.0,AI startup,Unknown,94117.65,385573.7223755650,"New York, United States",Leena AI offers a human resource management platform that transforms employee experience with conversational AI.,"Alan Patricof, Jim Moffatt"
Bizlog,2020,2014.0,Logistics,Unknown,11764.71,24889.952352704400,Bengaluru,Bizlog Value Chain enables re-commerce and circular economy through unique REVERSE LOGISTICS engine.,IAN Fund
Tamasha.live,2020,2018.0,Gaming,Unknown,3529.41,14093.14245528650,Mumbai,"Tamasha offers a platform for influencers to host live, video based, real money contests and games.","9Unicorns, Titan Capital, FirstCheque"
Fedo,2020,2015.0,AI startup,Unknown,11764.71,24703.28062497230,Bengaluru,Artificial Intelligence based Credit Score for Health,AIM Smart City
FabHotels,2020,2019.0,Hospitality,Unknown,11764.71,42869.443537566400,Gurugram,Fabhotels is the online aggregator for hotel rooms. It aims to provide standardized services at economical budgets.,"RB Investments Pte. Ltd, Goldman Sachs"
Freshokartz,2020,2017.0,AgriTech,Pre-series A,11764.71,28475.366752217800,"Jaipur, Rajastan","Freshokartz provides soil data based crop and fertilisers recommendation to farmers and delivery seeds, pesticides","Rajasthan Venture Capital Fund, Innovana Thinklabs"
FlexiLoans,2020,2018.0,FinTech,Debt,70588.24,112038.37811041300,Mumbai,"an online lending platform started with an endeavour to solve the problem that SMEs face in accessing Quick, Flexible and Adequate funds for growing their Businesses.",>Vikram Sud
Agrix,2020,2016.0,AgriTech,Unknown,323398839173535.44,1249750290696228.8,Patna,"Farming-as-a-service (covering farm machinery and agri input services) and provides market linkages, especially for fragmented farm owners.",Maple Capital Advisors
BharatAgri,2020,2016.0,AgriTech,Pre-series A,323398839173535.44,1606295540041626.2,Pune,A Smart Farming Technology Platform for Indian Farmers,"021 Capital, India Quotient"
FreshtoHome,2020,2019.0,E-commerce,Series C,1423529.41,6440979.886515940,Bengaluru,Freshtohome is an e-commerce platform for fresh and chemical-free seafood.,"Ascent Capital, Iron Pillar"
Credable,2020,2017.0,FinTech,Unknown,52941.18,230049.00840393000,Mumbai,CredAble provides working capital & supply chain finance programs for large enterprises and their suppliers and distributors.,Oaks Asset Management
Railofy,2020,2017.0,Transportation,Seed,58823.53,180489.60356358300,Mumbai,Railofy is a WL & RAC protection that enables waitlisted passengers to reach their destination at the lowest possible price.,"Roots Ventures, Better Capital"
Finova Capital,2020,2016.0,FinTech,Unknown,647058.82,1513785.9076307000,"Jaipur, Rajastan",Finova Capital is a non-banking financial company.,"Sequoia Capital India, Faering Capital"
Teachmint,2020,2016.0,Edtech,Seed,41176.47,69042.34307196970,Bengaluru,Teachmint is an easy to use platform for tutors to conduct unlimited live classes and manage their classrooms,Lightspeed India
Peel-Works,2020,2017.0,E-commerce,Unknown,35294.12,81736.00236572770,Mumbai,Peel-Works is a tech and data analytics company specializing in e-commerce for corner stores.,"CESC Ventures, Brun Raschle"
Janani,2020,2015.0,Fertility tech,Pre-seed,2352.94,3839.7730270709100,Bengaluru,Janani aims to make the process of infertility treatment and assisted fertilisation easier,9Unicorns
Credgenics,2020,2008.0,FinTech,Seed,38823.53,82826.9359490272,Gurugram,"Credgenics is a tech-enabled platform backed by Titan Capital, helping fintech lenders and Banks in their critical NPA reduction","Accel, Sunder Nookala"
Finelistings,2020,2012.0,Luxury car startup,Unknown,323398839173535.44,1022185124863624.1,New Delhi,A Used Luxury Car Marketplace,Justdial
Wellversed,2020,2018.0,Healthcare,Pre-series A,323398839173535.44,491935815473128.4,New Delhi,Wellversed Health enables production of customised clinical food products specific to health requirements of a demography or an individual.,"KLUB Works, Shankar Narayanan"
Nykaa,2020,2017.0,Cosmetics,Unknown,323398839173535.44,1491081574020568.5,Mumbai,Nykaa is an online marketplace for different beauty and wellness products.,"Alia Bhatt, Katrina Kaif"
Jumbotail,2020,2015.0,E-commerce,Series B2,129411.76,348022.65744688300,Bengaluru,"Jumbotail is solving an important problem of organising food and grocery ecosystem in India through technology, data science and design.",Nexus Venture Partners and 23 High Networth Individuals (HNIs)
Winzo,2020,2017.0,Gaming startup,Unknown,23529.41,102489.69198757300,New Delhi,WinZO is a mobile e-sports social gaming platform that offers monetary benefits and prizes to players.,"Makers Fund, Courtside Ventures"
mCaffeine,2020,2013.0,Cosmetics,Series B,58823.53,163214.42322988600,Mumbai,"MCaffeine is a personal care brand that offers caffein-infused face, body, and hair care products.","RPSG Ventures, Amicus Capital"
Pocket FM,2020,2018.0,FM,Series A,58823.53,117695.48194612400,Bengaluru,Pocket FM is an audiobook & podcast app that brings you over 10K+ popular audiobooks.,"Times Group, Lightspeed"
Snackible,2020,2019.0,Healthcare,Bridge,323398839173535.44,1441283792755614.8,Mumbai,Snackible operates a health-food production company designed to sell healthy snack food via online and offline channels.,"Mumbai Angels, Murali Nair"
FreshtoHome,2020,2017.0,E-commerce,Unknown,188235.29,675165.598382627,Bengaluru,Freshtohome is an e-commerce platform for fresh and chemical-free seafood.,"Ascent Capital, Iron Pillar"
Jumbotail,2020,2017.0,Retail,Series B2,129411.76,281184.07565362100,Bengaluru,Jumbotail is solving an important problem of organising food and grocery ecosystem in India,"Nexus Venture Partners, Capria Ventures"
Nykaa,2020,2015.0,E-commerce,Unknown,323398839173535.44,1526568850832432.5,Mumbai,Nykaa is an online marketplace for different beauty and wellness products.,"Katrina Kaif, Steadview Capital"
TagZ Foods,2020,2014.0,Food,Unknown,323398839173535.44,930411514086350.1,Bengaluru,TagZ Foods is a supplier of snacks and food products.,"Exfinity Venture Partners, Shesh Kondi"
Genius Teacher,2020,2019.0,Edtech,Unknown,23529.41,83114.5858623554,Mumbai,"Genius Teacher creates engaging educational content, delivers fun learning experience to the students","Sandeep Tandon, Daniel Lapus"
Krimanshi Feeds,2020,2017.0,Nutrition sector,Unknown,5882.35,28678.56394840180,Jodhpur,Krimanshi aims to increase rural income by improving the productivity of Indian cattle with better quality feed.,"Rajasthan Venture Capital Fund, AIM Smart City"
Origo,2020,2014.0,AgriTech,Debt,47058.82,162190.370562845,Gurugram,Provider of marketing and warehousing services for agricultural commodities.,Northern Arc Capital
GetVantage,2020,2017.0,FinTech,Seed,58823.53,109184.70928558200,Mumbai,GetVantage is India and Southeast Asia's first fintech enabled Revenue-based financing platform.,"Samyakth Capital, Venture Catalysts"
Biddano,2020,2018.0,Healthcare,Pre-series A,7058.82,28253.319693145800,Mumbai,India's 1st tech-enabled healthcare logistics platform.,Windrose Capital
InVideo,2020,2017.0,Video,Series A,176470.59,447825.5880856410,Mumbai,InVideo enables you to transform your content into great videos.,"Base Partners, Sequoia Capital India"
Arzooo,2020,2017.0,Retail Tech,Series A,88235.29,371631.9219912930,Bengaluru,"Retail tech platform empowering 300,000+ small retailers in electronics space to compete with big organised players and increase sales","3Lines, Jabbar Internet Group"
Hubilo,2020,2018.0,Tech company,Seed,52941.18,235879.7845573800,"San Francisco, California, United States",World’s smartest virtual event platform that brings Experience & Intelligence together,"Nishant Rao, Jonathan Boutelle"
BASIC Home Loan,2020,2017.0,FinTech,Seed,58823.53,121014.98572513100,Gurugram,"A platform for automating home loans for middle and low-income households in India,",Picus Capital
Ketos,2020,2017.0,AI startup,Unknown,211764.71,661684.8189974350,"San Francisco, United States",KETOS provides hardware and software analytics solutions and real-time data for usage and flow across water systems.,"Citi Ventures, Illuminated Funds Group"
SUGAR cosmetics,2020,2017.0,Cosmetics,Debt,23529.41,113306.14987890600,Mumbai,It is a cruelty-free makeup brand providing cosmetics that is high on style and higher on performance.,"A91 Partners, RB Investments Pte. Ltd"
Signzy,2020,2012.0,FinTech,Unknown,63529.41,175390.2170633340,Bengaluru,It is creating 'building blocks for a Digital Trust system.,"GenNext Ventures, Contrarian Drishti Partners"
Ahaguru,2020,2017.0,Edtech,Series A,323398839173535.44,902122408556738.6,Chennai,"It is conducting IIT JEE Coach for Physics, Math and Chemistry easily.",Anand Mahindra
Tekion,2020,2019.0,AI startup,Series C,1764705.88,4614211.892030410,"San Ramon, California",It is a cloud-built platform with advanced machine learning and AI capabilities for a personalized and seamless consumer experience.,"Alliance Ventures, Storm Ventures"
Brighteye Ventures,2020,2010.0,Edtech,Unknown,63529.41,232225.74923479600,"Paris, Ile-de-France, France",Education technology venture capital firm.,Tandem
EzeRx,2020,2017.0,Medtech,Seed,2352.94,8315.308165789500,Kolkata,Developer and manufacturer of medical devices,"Indian Oil Corporation, Krishna Chakravarty"
VitalTech,2020,2014.0,HeathTech,Seed,35294.12,148923.8443910410,"Plano, Texas, United States","VitalTech is a develop technologies that empower patients to better care for their safety,",Tech Mahindra
Genius Teacher,2020,2017.0,Edtech,Unknown,23529.41,108222.78252453500,Mumbai,"Genius Teacher creates engaging educational content, delivers fun learning experience to the students","Whiteboard Capital, VKG Ventures LLP."
Ultraviolette Automotive,2020,2015.0,Automobiles,Series B,47058.82,107937.9085143200,Bengaluru,Ultraviolette Automotive is a technology startup working on electric two-wheelers and energy infrastructure.,TVS Motor Company
Tring,2020,2017.0,Social Media,Unknown,323398839173535.44,685683978642426.8,Mumbai,"Tring is a celebrity engagement platform, for all occasions including birthday, anniversaries, get well soon messages.","Sujeet Kumar, Hemesh Singh"
Rare Planet,2020,2018.0,Retail startup,Pre-series A,4705.88,20637.774945418500,Kolkata,Rare Planet sells handicrafts made by local artisans.,Venture Catalysts
GoodGamer,2020,2017.0,Gaming,Seed,29411.76,60643.039144260400,Bengaluru,GoodGamer is India's first Daily Fantasy Sports and true Esports gaming platform.,Unknown
InnAccel,2020,2014.0,Medtech,Pre-series A,17647.06,86748.95083844270,Bengaluru,"A building a portfolio of novel medical devices designed, engineered, and priced for global Emerging Markets.",Mount Judi Ventures
Tiliter,2020,2018.0,Retail,Unknown,88235.29,307432.3817485070,Sydney,Software that uses computer vision to recognise products without barcodes,"AngelList, Investec"
Slintel,2020,2012.0,Sles and marketing,Unknown,49411.76,245134.55575070000,"San Francisco Bay Area, Silicon Valley, West Coast","Slintel, a leader in capturing technographics-powered buying intent, helps companies uncover the 3% of active buyers in their target market.","Accel, Stellaris Venture Partners"
SoOLEGAL,2020,2018.0,LegalTech,Unknown,47058.82,178887.5708144200,New Delhi,"SoOLEGAL is a global integrated directory of lawyers, legal aid organizations, and Law firms.",Unknown
HobSpace,2020,2012.0,Edtech,Seed,2352.94,7672.465732213810,Mumbai,India's Activity Hub for Kids,Artha Venture
Supplynote,2020,2017.0,SaaS startup,Seed,5882.35,21347.575098987400,Noida,Supplynote is India's leading procurement platform with a unique stack of SAAS and E-commerce to solve the procurement problem,"MOX, SOSV"
Hire Me Car,2020,2016.0,Car Service,Seed,323398839173535.44,1324842166743863.5,Noida,India's largest cloud based digital discovery and services provisioning platform for the taxi rental,Unknown
ShopUp,2020,2012.0,E-commerce,Series A,258823.53,628541.5624755070,Bangaldesh,"ShopUp provides easy access to B2B sourcing, last-mile logistics, digital credit, and business management solutions to small businesses.","Flourish Ventures, Lonsdale Capital"
Harmonizer India,2020,2015.0,Tech Startup,Unknown,323398839173535.44,515951418027868.5,Bengaluru,"Energy-efficient solutions based on the Artificial Intelligence, Machine Learning and Internet of Things technology,",Kapil Dev
Zomato,2020,2019.0,FoodTech,Unknown,611764.71,1201102.712053240,Gurugram,Zomato is a food delivery and restaurant discovery site that provides information and reviews about restaurants.,"Kora, Tiger Global Management"
Dukaan,2020,2019.0,Tech Startup,Seed,70588.24,331751.78551200800,Mumbai,Developer of an android application designed for businesses to sell online.,"Lightspeed, Matrix Partners."
CredR,2020,2017.0,Bike marketplace,Unknown,23529.41,42424.541108385000,Mumbai,India’s Only 100% Inspected and Certified Used Bikes Marketplace.,"Eight Roads Ventures, On Mauritius"
Satyukt,2020,2017.0,Agri tech,Seed,5882.35,27594.674059260100,Bengaluru,An agritech company that provides business to business (B2B) agricultural data,"NABVENTURES, Social Alpha (India)"
RACEnergy,2020,2012.0,Automobiles,Unknown,323398839173535.44,1511545912773573.2,Hyderabad,RACEnergy builds and deploys battery swapping infrastructure for use in various segments of vehicles.,"growX Ventures, Huddle (Incubator)"
TREAD,2020,2015.0,Fitness startup,Pre-seed,12941.18,43309.43308675380,Bengaluru,A homegrown fitness startup that aims to advance the 'Fit India' initiative by offering holistic and affordable workouts.,"Better Capital, Kunal Shah, Gaurav Munjal"
Anveshan,2020,2018.0,FoodTech,Pre-seed,1176.47,5004.531029825590,Bengaluru,Provide quality and healthy food products,Titan Capital
TeaMonk,2020,2017.0,Food & Bevarages,Pre-series A,10588.24,23043.21992416440,Bengaluru,India's Finest Specialty Tea company.,"Lead Angels Network, Roots Ventures"
Fleetx,2020,2017.0,Tech Startup,Pre-series B,35294.12,156361.48294944000,Gurugram,"Fleetx is an intelligent data platform which uses AI, machine learning, sensors and predictive analytics to help fleet owners.","Rohit Bansal, Rohan Ranavat"
ReNEWate,2020,2017.0,Real Estate,Pre-seed,323398839173535.44,1502309202759000.2,Pune,"Tech platform helping millions of renovation contractors, property improvement professionals and businesses manage their business digitally.",Real Estate Accelerator Program
Tango Eye,2020,2018.0,SaaS startup,Seed,323398839173535.44,1327495771037950.2,Chennai,Retail Video Analytics SaaS product,"Riso Investments, Lenskart"
Rare Planet,2020,2015.0,Reatil startup,Pre-series A,323398839173535.44,1292298565602664.0,Kolkata,Rare Planet sells handicrafts made by local artisans.,Venture Catalysts
Avataa Me,2020,2016.0,AR platform,Series A,82352.94,362399.4199336270,Bengaluru,AVATAAR.ME is a deep-tech 3D AR platform which delivers personalized fashion discovery experience to users on mobile devices.,Sequoia Capital India
Arrival,2020,2017.0,EV startup,Unknown,1388235.29,2497519.9514112400,"London, England, United Kingdom",Arrival is a technology company that specializes in developing electric vehicles.,"UPS Ventures, Hyundai Motor Company"
Cover Genius,2020,2017.0,FinTech,Unknown,176470.59,879176.2027752200,"Sydney, New South Wales, Australia",Cover Genius provides an insurance distribution platform designed to protect the customers of e-commerce companies,"King River Capital, Leap Capital"
Phononic Vibes,2020,2016.0,Deeptech,Unknown,27058.82,93919.54492488190,"Milano, Lombardia, Italy","Phononic Vibes introduces a new patented technology for vibration and noise control and isolation, with a circular economy approach.",Unknown
MikeLegal,2020,2016.0,LegalTech,Seed,323398839173535.44,754559613895602.5,Gurugram,MikeLegal is an AI powered legal associate that aims to build an ecosystem of legal tools,"SOSV, Artesian"
Clair,2020,2016.0,FinTech,Seed,52941.18,144983.97614297900,"New York, United States",Clair is a social fintech that provides Instant Pay Access as a Service for human capital management and gig platforms.,"Upfront Ventures, Walkabout Ventures"
Gourmet Garden,2020,2019.0,Consumer Goods,Unknown,323398839173535.44,1269350553897358.2,"Palmwoods, Queensland, Australia",Gourmet Garden is a global market leader in chilled convenient packaged herbs.,Advent Partners
Miko,2020,2015.0,AI startup,Pre-series B,35294.12,82995.83610572940,Mumbai,"Miko is an advanced robotics startup founded by three IIT Bombay post-graduates on the pillars of robotics, AI & IoT.","Stride Ventures, YourNest Venture Capital"
Razorpay,2020,2009.0,FinTech,Series D,1176470.59,4503851.4314775800,Bengaluru,"Razorpay is a platform that enables businesses to accept, process, and disburse payments.","Tiger Global Management, Sequoia Capital India"
Wow! Momo,2020,2017.0,Food Industry,Debt,58823.53,112347.86859971200,Kolkata,Wow! Momo is a chain of fast-food restaurants that specializes in momos.,"Tiger Global Management, William Bissell"
Pepper Content,2020,2017.0,Content marketplace,Series A,49411.76,78833.107900499,Mumbai,Pepper Content is a Content-Mediation Platform that connects talented writers to organisations that require content.,"Alok Mittal, Manan Maheshwari"
LIVSPACE,2020,2017.0,Interior Design,Debt,47058.82,227554.07790217000,Bengaluru,"Livspace is an interior design startup that offers a platform that connects people to designers, services, and products.","Mercer Investments, Bessemer Venture Partners"
Acculi Labs,2020,2017.0,Healthcare,Seed,7058.82,22642.843691213900,Bengaluru,Acculi Labs is a clinical grade smartphone based diagnostic tool,Startup Basket.
Your MD,2020,2017.0,Healthcare,Unknown,294117.65,615464.6159409350,"London, England, United Kingdom",Your.MD is a platform committed to helping a billion people find their health by unlocking self-care with digital technology.,"Orkla Ventures, Smedvig Capital"
Antaios,2020,2018.0,Tech company,Unknown,129411.76,628471.644188769,France,Developer of memory-based technology intended to solve issues of advanced computing.,Unknown
Unnati,2020,2016.0,AgriTech,Pre-series A,20000.0,98911.32677847160,Noida,A helping hand to the farming community through Artificial Intelligence,NABVENTURES
Disprz,2020,2015.0,Edtech,Pre-series B,18823.53,60422.04013423200,Chennai,"Disprz is a one-of-its-kind “knowledge-tech” start-up that strives to make people knowledgeable, productive and smarter at what they do.","Xseed Partners, InnoVen Capital"
Uni,2020,2008.0,FinTech,Seed,217647.06,634808.6234926740,Mumbai,The team aims to bridge the gap for credit cards and make them more accessible for people across different regions.,"Lightspeed India Partners, Accel India"
Credit Wise Capital,2020,2014.0,FinTech,Seed,70588.24,279121.3434465580,Mumbai,CreditWise Capital is a consumer finance company.,Venture Catalysts
Chargebee,2020,2017.0,SaaS startup,Series F,647058.82,1502331.8139368300,"San Francisco Bay Area, West Coast, Western US",Chargebee is a PCI Level 1 certified subscription and recurring billing system for SaaS and subscription based eCommerce businesses,"Accel, Steadview Capital"
Reliance Retail Ventures Ltd,2020,2015.0,Retail,Unknown,823529411.76,2157171853.4748600,Mumbai,"Reliance Retail offers online shopping and a chain of neighborhood stores, supermarkets, and wholesale/specialty stores.","Silver Lake, Mubadala Investment Company"
