Company Name,Year_Funded,Founded_in,Industry,Round/Series,Amount,Revenue,Location,About Company,Investors
Satin Creditcare,2020,2017.0,Fintech,Unknown,176470.59,735261.3524704360,Gurgaon,A micro finance company,Austrian Bank
XpressBees,2020,2015.0,Logistics,Unknown,117647.06,562916.2281537200,Unknown,Provides end to end supply chain solutions,Alibaba
FarmERP,2020,2001.0,Agritech,Series A,323398839173535.44,1010781992928929.2,Pune,Smart agriculture management ERP software platform,TechnoGen
Wealth Bucket,2020,2018.0,Fintech,Unknown,35294.12,144276.2974758940,Unknown,An online platform for mutual fund investments,"NorthStar, Vinod Khatumal"
GoMechanic,2020,2016.0,Automobile Technology,Series B,172941.18,289217.6127738750,Delhi,Find automobile repair and maintenance service providers,"Chiratae Ventures, Sequoia Capital, Orios Venture Partners"
Fashor,2020,2017.0,Fashion,Pre Series A,11764.71,36959.249137958200,Chennai,Women’s fashion and apparel,Sprout venture partners
Leverage Edu,2020,2017.0,Edtech,Unknown,17647.06,47509.334954038700,Delhi,AI enabled marketplace that provides career guidance,"DSG Consumer Partners, Blume Ventures"
EpiFi,2020,2017.0,Fintech,Seed Round,155294.12,692997.7096877210,Unknown,It offers customers with a single interface for all their financial and banking mandates,"Sequoia India, Ribbit Capital"
Purplle,2020,2012.0,Cosmetics,Unknown,94117.65,434953.0619524020,Mumbai,Online makeup and beauty products retailer,Verlinvest
Shuttl,2020,2015.0,Transport,Series C,94623.53,263624.07674632600,Delhi,App based bus aggregator serice,SIG Global India Fund LLP.
Unbox Robotics,2021,2020.0,AI startup,Pre-series A,14117.65,62050.5408588811,Bengaluru,"Unbox Robotics builds on-demand AI-driven warehouse robotics solutions, which can be deployed using limited foot-print, time, and capital.","BEENEXT, Entrepreneur First"
upGrad,2021,2020.0,EdTech,Unknown,1411764.71,6363228.071392690,Mumbai,UpGrad is an online higher education platform.,"Unilazer Ventures, IIFL Asset Management"
Lead School,2021,2015.0,EdTech,Series D,352941.18,1486965.1556828800,Mumbai,LEAD School offers technology based school transformation system that assures excellent learning for every child.,"GSV Ventures, Westbridge Capital"
Bizongo,2021,2016.0,B2B E-commerce,Series C,600000.0,2853329.0784846200,Mumbai,Bizongo is a business-to-business online marketplace for packaging products.,"CDC Group, IDG Capital"
FypMoney,2021,2016.0,FinTech,Seed,23529.41,60846.286291094400,Gurugram,"FypMoney is Digital NEO Bank for Teenagers, empowering them with financial literacy and ease of secured financial transactions.","Liberatha Kallat, Mukesh Yadav, Dinesh Nagpal"
Urban Company,2021,2014.0,Home services,Unknown,2211764.71,3960011.5704177200,New Delhi,"Urban Company (Formerly UrbanClap) is a home and beauty services platform in India, Middle East, Singapore and Australia",Vy Capital
Comofi Medtech,2021,2016.0,HealthTech,Unknown,2352.94,4477.380364658090,Bengaluru,Comofi Medtech is a healthcare robotics startup.,"CIIE.CO, KIIT-TBI"
Qube Health,2021,2015.0,HealthTech,Pre-series A,323398839173535.44,1327305255281019.2,Mumbai,India's Most Respected Workplace Healthcare Management Company,Inflection Point Ventures
Vitra.ai,2021,2012.0,Tech Startup,Unknown,323398839173535.44,927766791311784.8,Bengaluru,Vitra.ai is an AI-based video translation platform,Inflexor Ventures
Taikee,2021,2015.0,E-commerce,Unknown,11764.71,31381.920463852800,Mumbai,"Taikee is the ISO-certified, B2B e-commerce platform of Peel-Works, enabling better lives for corner stores.",Unknown
Fitterfly,2021,2018.0,HealthTech,Pre-series A,35294.12,109499.26741055500,Mumbai,"Fitterfly offers customized and personalized wellness programs for diabetes PCOS, pregnancy, weight loss, pediatric and nutrition.","9Unicorns Accelerator Fund, Metaform Ventures"
FreeStand,2021,2021.0,B2B service,Unknown,1176.47,5637.82194164649,New Delhi,FreeStand enables FMCG brands to execute trackable and scalable product sampling campaigns.,"SucSEED Indovation, IIM Calcutta Innovation Park"
MyDentalPlan,2021,2016.0,Helathcare,Seed,8235.29,26295.336579824400,Bengaluru,My Dental Plan provides dental care packages and services.,Safe Planet Medicare
Freyr Energy,2021,2018.0,Renewable Energy,Unknown,23529.41,62448.07000600530,Hyderabad,"Freyr Energy is a company that provides full service solar provider based in Hyderabad, India.","Impact Partners, C4D Partners"
DealShare,2021,2018.0,E-commerce,Unknown,105882.35,255700.08971320900,Jaipur,DealShare is a Social Commerce Startup,"Tiger Global Management, InnoVen Capital"
Tessolve,2021,2017.0,Electronics,Unknown,470588.24,1824299.093160620,Bengaluru,"Tessolve Semiconductor offers engineering in semiconductor design, test/product engineering, failure analysis, systems design.",Novo Tellus Capital
Smart Joules,2021,2015.0,Renewable Energy,Unknown,576470.59,2389377.418610250,New Delhi,Smart Joules is an energy management company.,"Raintree Family Office, ADB arm"
ORAI,2021,2009.0,IT startup,Pre-series A,4705.88,9100.871351904310,Bengaluru,AI-Powered Robotic Virtual Assistant (RVA) for Amplifying Performance of Poor quality leads and bring more MQL and SQL,Inflection Point Ventures
ixamBee,2021,2013.0,EdTech,Seed,3529.41,10523.651507093800,New Delhi,ixamBee is to provide best online learning experience for preparation of competitive exams.,"Mumbai Angels, Narendra Shyamsukha"
CoinSwitch Kuber,2021,2015.0,FinTech,Series B,294117.65,937249.8921677980,Bengaluru,CoinSwitch Kuber is an India-based cryptocurrency exchange platform.,"Paradigm, Kunal Shah"
Razorpay,2021,2002.0,FinTech,Series E,1882352.94,8234019.791556470,Bengaluru,"Razorpay is a platform that enables businesses to accept, process, and disburse payments.","Matrix Partners India, GIC"
Uable,2021,2014.0,EdTech,Seed,323398839173535.44,1126663826531693.2,Bengaluru,Uable offers role based programmes to empower children to explore different domains.,"Chiratae Ventures, JAFCO Asia"
ZFW Hospitality,2021,2015.0,Food & Beverages,Pre-seed,1764.71,4438.536408590590,New Delhi,Creating a sustainable and scalable cloud kitchen network.,"Mumbai Angels Network, Expert DOJO"
Optimized Electrotech,2021,2020.0,Aeorspace,Pre-series A,21176.47,97376.46094110400,Ahmadabad,"Long distance, multispectral Surveillance Equipment for Defense, Aerospace, Critical Asset Protection",GVFL
Northern Arc,2021,2021.0,FinTech,Unknown,58823.53,146186.0606345080,Chennai,Northern Arc Capital is a Non-Banking Finance Company that provides borrows with access to debt investors.,"Kotak Mahindra Bank, FMO"
Chara,2021,2021.0,Deep Tech,Seed,10000.0,38930.475867096900,Bengaluru,"A scalable, cloud-controlled, and rare earth mineral free Hardware and Software platform for the Switched Reluctance Motor and other magnet free motor technologies.",Kalaari Capital
Sirona Hygiene,2021,2021.0,HealthTech,Series A,35294.12,130757.21712345100,New Delhi,Solving unaddressed Intimate & Menstrual Hygiene issues with our award-winning innovative & modern products.,"NB Ventures, IAN Fund"
Pristyn Care,2021,2009.0,HealthTech,Series D,623529.41,1315830.530038530,Gurugram,Pristyn Care is Health Care Startup that is disrupting Elective Surgery Procedures,"Sequoia Capital India, Hummingbird Ventures"
TrulyMadly,2021,2020.0,Dating,Pre-series A,23529.41,38848.78574440800,New Delhi,Trulymadly is a dating platform that uses a match making algorithm.,"Gaurav Munjal, Snehil Khanor"
Vidyakul,2021,2021.0,EdTech,Seed,5882.35,12654.867733281400,Unknown,Vidyakul is an vernacular e-learning platform that helps state board students to learn academics via pre-recorded and live lectures,"JITO Angel Network, SOSV"
Jambox Games,2021,2021.0,Gaming,Seed,12941.18,34735.938112589300,Bengaluru,"A competitive game publishing platform to help developers in India and Southeast Asia to publish their games, and compete with the global incumbents.",Unknown
Miko,2021,2021.0,Robotics,Unknown,70588.24,188971.55812497700,Mumbai,"Miko is an advanced robotics startup focusing on robotics, AI & IoT.","Chiratae Ventures, YourNest Venture Capital"
SuperK,2021,2015.0,Retail,Seed,9411.76,39844.538314692100,"Small Towns, Andhra Pradesh",SuperK is a full-stack solution to empower small format retail stores in India.,STRIVE VC
TagZ Foods,2021,2019.0,Food,Pre-series A,5882.35,27470.560675875600,Bengaluru,TagZ Foods is a supplier of snacks and food products.,Venture Catalysts
Fuel Buddy,2021,2018.0,Oil and Energy,Unknown,11764.71,53873.68238654590,New Delhi,FuelBuddy is the FIRST legal private company in India to have permissions in place to deliver fuel. FUELDELIVERY APP.,Jaipuria Family Office
M1xchange,2021,2020.0,FinTech,Unknown,117647.06,490928.9591288660,Gurugram,M1 an online exchange for TReDS set up under the approval RBI to facilitate discounting of invoices on a PAN India basis.,Amazon
Spintly,2021,2020.0,Tech Startup,Unknown,5882.35,26095.574141939900,Goa,Wireless cloud based access control platform,Riso Capital
EF Polymer,2021,2009.0,AgriTech,Unknown,2352.94,6666.273519647370,Rajsamand,Sustainable Agriculture by creating sustainable inputs solution for agriculture to save water and fertilizer with enhancing yield.,MTG Ventures
boAt,2021,2021.0,Electronics,Unknown,70588.24,217079.21230773900,New Delhi,boAt is a consumer electronics and lifestyle company.,"Qualcomm Ventures, Warburg Pincus"
TruNativ,2021,2021.0,Food & Beverages,Seed,323398839173535.44,700531039300966.4,Mumbai,TruNativ Foods & Beverages Pvt Ltd,9Unicorns
iBus,2021,2021.0,Telecommuncation,Unknown,247058.82,671655.0937462890,Bengaluru,iBus Networks is an in-building connectivity solutions company,Morgan Stanley
Puresh Daily,2021,2009.0,Milk startup,Seed,1176.47,4962.278899811590,Ranchi,PUREandFRES-Milk delivers fresh milk directly from its farm to home. Fresh Milk without any trace of chemicals is packed and sealed in glass bottle.,"Alfa Ventures, Agility Venture Partners"
LearnVern,2021,2020.0,EdTech,Unknown,11764.71,32873.91489928760,Ahmadabad,LearnVern.com is a training portal where anyone can learn any course in vernacular languages for free.,Unknown
LimeChat,2021,2021.0,AI Chatbot,Seed,88235.29,204396.3613523950,"Faridabad, Haryana",Limechat provides a personalised shopping experience for D2C companies on chat platforms using L3 conversational AI.,"Stellaris Venture Partners, Ramakant Sharma"
Dybo,2021,2021.0,IT,Seed,1176.47,4420.113442675480,Bengaluru,Product Visualisation Technology for Commerce,Spanache
moEVing,2021,2021.0,Logistics,Seed,11764.71,50837.46501744750,Gurugram,"Delivering clean, cost-effective and efficient mobility solutions.",Unknown
WeWork India,2021,2015.0,Hospitality,Unknown,305882.35,1337585.9903421000,Bengaluru,"Transform buildings into beautiful, collaborative workspaces and provide infrastructure, services, events and tech",Unknown
Solethreads,2021,2019.0,Fashion,Series A,11764.71,32082.323617959700,Gurugram,SOLETHREADS is a ‘Made in India’ footwear brand that’s creating a flip flop revolution.,"DSG Consumer Partners, Saama Capital"
Beldara,2021,2018.0,E-commerce,Unknown,87058.82,431884.8262063590,Mumbai,"BELDARA.COM IS A GLOBAL B2B marketplace, enables businesses to sell worldwide.",Hindustan Media Ventures
CredFlow,2021,2020.0,FinTech,Seed,23529.41,72552.89950187940,New Delhi,CredFlow provides financial solutions to automate your cashflows.,"Stellaris Venture Partners, Omidyar Network India, Flourish Ventures"
Do Your Thng,2021,2020.0,Marketing,Unknown,17647.06,55724.896368222800,Gurugram,World's first shared economy platform for digital assets.,"Angelbay Holdings, Faad Network"
Oye Rickshaw,2021,2009.0,Transportation,Unknown,35294.12,107076.96852786700,Gurugram,Oye Rickshaw is an electric vehicle energy solutions company that connects people with public transportation using a booking app.,"Alteria Capital, Chiratae Ventures"
Legitquest,2021,2021.0,LegalTech,Unknown,7058.82,21352.641214939700,New Delhi,LegitQuest is a legal-tech company that operates a legal research platform with Indian case laws.,"WaterBridge Ventures, Info Edge"
Swiggy,2021,2018.0,Food delivery,Unknown,9411764.71,18476616.46181510,Bengaluru,Swiggy is an on-demand food delivery platform that brings food from neighborhood restaurants directly to customers' doors.,"Carmignac, Falcon Edge Capital"
AntWak,2021,2018.0,EdTech,Seed,323398839173535.44,1122130092820525.6,Bengaluru,AntWak provides a video platform for e-learning service.,"Vaibhav Domkundwar, Kunal Shah"
PlayShifu,2021,2020.0,EdTech,Series B,200000.0,471417.93397997100,Bengaluru,PlayShifu is an EdTech startup that offers teaching/learning tools for kids (4-12 years of age).,"Chiratae Ventures, Bharat Innovation Fund"
Pitstop,2021,2018.0,Automotive,Pre-series B,41176.47,115659.63575894900,Bengaluru,Pitstop offers general repair and maintenance services for cars through its doorstep service vehicles.,"Acko Technology, Services, LetsVenture"
Lendingkart,2021,2018.0,FinTech,Debt,176470.59,359335.02595373500,Gujarat,Lendingkart is an online financing company dedicated to help entrepreneurs and small businesses with Working Capital Loans.,"Bertelsmann India Investments, Fullerton Financial Holdings"
CRED,2021,2002.0,FinTech,Series D,2529411.76,5787128.634976400,Bengaluru,CRED is a members-only credit card management and bill payments platform that rewards users every time they pay their credit card bills.,"Dragoneer Investment Group, Tiger Global Management"
Karnival,2021,2012.0,SaaS startup,Seed,29411.76,83887.77045616170,Bengaluru,A SAAS platform for retailers and brands to create wonderful post purchase customer journeys using smart receipts technology,http://100x.vc/
PharmEasy,2021,2017.0,HealthTech,Series E,4117647.06,18728525.36283680,Mumbai,"PharmEasy is a health tech startup offering services such as teleconsultation, medicine deliveries, and diagnostic test sample collection.","TPG Growth, Caisse de Depot et Placement du Quebec"
WESS,2021,2012.0,Renewable Energy,Seed,23529.41,98187.86965144850,Mumbai,Waaree is India's Largest Solar Module Manufacturer & fastest growing EPC company with Presence across 68 countries.,Centrum Financial Services
ShopSe,2021,2010.0,FinTech,Unknown,64705.88,142235.80490413400,Mumbai,Make purchases online or at neighborhood store in easy EMIs through ShopSe.,"Chiratae Ventures, BEENEXT"
Fantasy Akhada,2021,2015.0,Fantasy sports,Unknown,7058.82,35139.55172281190,Gurugram,Fantasy Akhada offers fantasy sports platform for cricket and football.,Harsha Bhogle
Rage Coffee,2021,2020.0,Food & Beverages,Pre-series A,323398839173535.44,608992722222663.6,New Delhi,Rage Coffee is infused with plant based vitamins. These 100% natural extracts are typically found in foods.,"GetVantage, Prakash Katama"
Groww,2021,2020.0,FinTech,Series D,976470.59,2012682.6949330600,Bengaluru,Groww is an investment platform that offers a new way of investing money with stockbroking and direct mutual funds.,"Tiger Global Management, Y Combinator Continuity Fund"
Avanti Finance,2021,2020.0,FinTech,Series A,305882.35,1277758.6755143600,Bengaluru,Avanti Finance lends relatively large but trust-based loans without formal credit footprint.,Michael & Susan Dell Foundation
Kudos,2021,2020.0,FinTech,Pre-series A,323398839173535.44,1047507810777390.2,Pune,"Kudos is a full stack NBFC, a digital lending engine with an in-built API lending protocol layer of over 20+ API’s.",Marquee fintech founders
OfBusiness,2021,2021.0,FinTech,Unknown,1294117.65,3249762.1080143700,Gurugram,OfBusiness is a financing platform that offers smart financing to SMEs.,"Falcon Edge India, Norwest Venture Partners"
Superpro.ai,2021,2021.0,Video communication,Seed,35294.12,162925.4309580360,Bengaluru,Enabling independent professionals to bring offline consulting online with AI,"SOSV, Omphalos Ventures India"
ShareChat,2021,2017.0,Social Media,Unknown,5882352.94,12093146.694477200,Bengaluru,ShareChat is a social networking and regional content platform.,"Twitter Ventures, Pawan Munjal"
WiT-ACE,2021,2015.0,Skill development,Seed,11764.71,22550.123903361500,Gurugram,"Offer accelerated career experiences for women by Enabling, Engaging & Employing them to be in decision making roles.",CitiusTech
Spinny,2021,2015.0,Retail,Series C,764705.88,2478000.423370790,Gurugram,Spinny is a used car buying platform enabling trustworthy and hassle-free transactions.,"Arena Holdings, Think Investments"
Alteria Capital,2021,2019.0,FinTech,Debt,1764705882.35,4857270744.774850,Mumbai,Alteria Capital is a Venture debt firm .,Unknown
Safexpay,2021,2017.0,FinTech,Unknown,70588.24,341294.4675619260,Thane,SafexPay is set up with the aim to build digital payments businesses and channel platforms encompassing payment gateways,"T Choithrams BVI, Ardor"
PumPumPum,2021,2014.0,Rental,Pre-series A,8235.29,20494.242823107500,Gurugram,Pumpumpum is a car rental company.,"Kogta Financial India Limited, ICICI Bank"
Speciale Invest,2021,2019.0,FinTech,Unknown,117647.06,210552.21573204900,Bengaluru,Speciale Invest is an early stage investor focusing on Tech-driven/Deep-tech ventures.,Unknown
Meesho,2021,2019.0,E-commerce,Unknown,3529411.76,12865582.867235900,Bengaluru,Meesho operates as an online reselling platform that enables anyone to start a business without investment.,"SAIF Partners, Venture Highway"
CareerLabs,2021,2021.0,EdTech,Unknown,25882.35,54542.49300801600,Bengaluru,"Aim to help students become future-ready, setting them on a path to success that suits them best.",Global Founders Capital
Uable,2021,2015.0,EdTech,Pre-series A,411764.71,1956310.576644300,Bengaluru,Uable are on a bold mission to redefine the future for millions of teenagers around the world.,"JAFCO Asia, Chiratae Ventures"
Zoko,2021,2015.0,Tech Startup,Seed,1647058.82,4197977.892489880,Bengaluru,"Zoko makes it easy for businesses to do Sales, Marketing & Customer Support on WhatsApp.",Y Combinator
GetWork,2021,2019.0,Recruitment,Seed,2352.94,10028.939641488900,Gurugram,GetWork is a campus recruiting platform to post your jobs and hire across dozens of colleges at once.,Artha Venture Fund
Easebuzz,2021,2018.0,E-commerce,Series A,47058.82,85363.27196389560,Pune,Easebuzz is an easy to use portal which allows you to start an online business and sell your favorite products with a free online store.,"Jitendra Gupta, Amrish Rau"
Chingari,2021,2019.0,Social Media,Unknown,152941.18,617260.7435368520,Bengaluru,Chingari operates as a short video platform.,"FJ Labs, Brian Norgard"
DusMinute,2021,2021.0,Retail,Pre-series A,12941.18,40189.81276104130,Bengaluru,DusMinute aims to transform how communities live by giving them access to world-class amenities at their doorstep.,Indian Angel Network
Onsurity,2021,2019.0,HealthCare,Unknown,323398839173535.44,1030314798509926.5,Bengaluru,Onsurity is an employee healthcare platform providing a monthly healthcare membership with group health insurance to emerging businesses.,"Jitendra Gupta, Harsh Shah"
Karbon Card,2021,2015.0,FinTech,Unknown,323398839173535.44,1247836888589008.2,Bengaluru,Prime objective is to empower Indian startups by creating the right financial products starting with a high-limit corporate credit card with unlimited benefits,Y Combinator
Factors.AI,2021,2020.0,SaaS startup,Unknown,23529.41,47657.446181184300,Bengaluru,"Factors.AI is a Marketing Analytics platform providing sophisticated omnichannel, every-touch attribution technology and unparalleled performance insights for Marketers","Elevation Partners, Emergent Ventures"
Elevar,2021,2019.0,Sports,Unknown,23529.41,89183.09693922140,Mumbai,"A Revolutionary Sports Brand, Engineered For Those Who Want More.","Kalaari Capital, Dream Capital"
Studio Sirah,2021,1994.0,Computer Games,Unknown,9411.76,17705.75739512090,Bengaluru,Studio Sirah is founded with a belief in the increasing sophistication of the Indian gamer and the whitespace of midcore India-first games.,Lumikai
OTO Capital,2021,2017.0,FinTech,Unknown,70588.24,345646.17376554700,Mumbai,The Future Of Vehicle Ownership!,Matrix Partners India
1Bridge,2021,2016.0,Consumer Goods,Unknown,29411.76,51349.402595937200,Bengaluru,"Village Commerce Network - Bridging Aspirations, Creating Opportunities, Bringing Prosperity & Abundance to our village",C4D Partners
Skeps,2021,2010.0,FinTech,Unknown,111764.71,358238.3027032350,Gurugram,"A blockchain products company, developing a proprietary product in the FinTech space",Bertelsmann India
Curefoods,2021,2011.0,Food & Beverages,Unknown,152941.18,281093.22762484700,Bengaluru,Healthy & nutritious foods and cold pressed juices produced in Edinburgh. Currently distributing wholesale within the Edinburgh region.,"Iron Pillar, Nordstar, Binny Bansal"
TartanSense,2021,2020.0,Information Technology,Unknown,58823.53,192932.20249420700,Bengaluru,TartanSense unlocks value for small farm holders by working at the intersection of robotics and AI assisted computer vision.,"FMC, Omnivore, Blume Ventures"
Bewakoof,2021,2020.0,Apparel & Fashion,Unknown,94117.65,455761.0784974880,Mumbai,"Bewakoof is a lifestyle fashion brand that makes creative, distinctive fashion for the trendy, contemporary Indian.",InvestCorp
Kirana247,2021,2020.0,Logistics & Supply Chain,Unknown,11764.71,24201.942655538700,New Delhi,An on-demand FMCG supply chain company leveraging a deep tech-enabled micro warehousing model to serve Kirana stores.,Unknown
NeoDocs,2021,2013.0,Healthtech,Unknown,323398839173535.44,1017235815480636.5,Mumbai,"Neodocs is a part of India's prominent Social Impact Accelerator program, AISEA.","Y Combinator, 9Unicorns, Titan Capital"
IsGoingOnline,2021,2015.0,Retail,Unknown,2352.94,7243.240018348550,Cochin,Kochi-based digital catalogue and marketplace IsGoingOnline,"Unicorn India Ventures, SEA Fund, Devdatt Shah"
Camp K12,2021,2019.0,EdTech,Unknown,141176.47,545936.4159168380,Gurugram,"Camp K12 is a global online school for 21st century skills, teaching Coding and other STEAM subjects to kids age 6-18 via LIVE, interactive, gamified online sessions","Matrix Partners India, Elevation Capital"
Elda Health,2021,2021.0,Healthcare,Unknown,17647.06,58958.4692393238,Bengaluru,"Elda Health is a digital wellness platform that understands women intimately and offers a holistic wellness solution through physical, mental and social interventions.","Avaana Capital, Orios Ventures"
Sporjo,2021,2020.0,SportsTech,Unknown,23529.41,41674.26246617550,Mumbai,A one stop destination to build a successful career in the Indian sports industry!,Punit Balan
Advantage Club,2021,2021.0,HRTech,Unknown,20000.0,64118.21485305580,Mumbai,"Advantage Club is India's largest employee engagement platform, Provide end to end employee benefit management with state of the art products like:","Y Combinator, Broom Ventures, Kunal Shah"
SuperGaming,2021,2016.0,Gaming,Unknown,64705.88,214156.56531227500,Pune,"At SuperGaming, building India's best gaming company.","Skycatcher, AET Fund, BAce Capital, Dream Incubator, 1Up Ventures"
Ruptok,2021,2011.0,FinTech,Unknown,11764.71,17665.879577764100,New Delhi,"Ruptok fintech Pvt. Ltd. is an online gold loan service provider , with attractive interests rate .",Eclear Leasing
Curefoods,2021,2019.0,Food & Beverages,Unknown,152941.18,451646.0579112090,Bengaluru,Healthy & nutritious foods and cold pressed juices produced in Edinburgh. Currently distributing wholesale within the Edinburgh region.,"Iron Pillar, Nordstar, Binny Bansal"
TartanSense,2021,2006.0,Information Technology,Series A,58823.53,151407.3902678280,Bengaluru,TartanSense unlocks value for small farm holders by working at the intersection of robotics and AI assisted computer vision.,"FMC, Omnivore, Blume Ventures"
Bewakoof,2021,2019.0,Apparel & Fashion,Unknown,94117.65,306972.71624387000,Mumbai,"Bewakoof is a lifestyle fashion brand that makes creative, distinctive fashion for the trendy, contemporary Indian.",InvestCorp
Kirana247,2021,2016.0,Logistics & Supply Chain,Pre-series A,11764.71,43987.692754875500,New Delhi,An on-demand FMCG supply chain company leveraging a deep tech-enabled micro warehousing model to serve Kirana stores.,Unknown
NeoDocs,2021,2016.0,Healthtech,Pre-seed,323398839173535.44,1540090111333182.2,Mumbai,"Neodocs is a part of India's prominent Social Impact Accelerator program, AISEA.","Y Combinator, 9Unicorns, Titan Capital"
IsGoingOnline,2021,2017.0,Retail,Pre-series A,2352.94,7256.07761593123,Cochin,Kochi-based digital catalogue and marketplace IsGoingOnline,"Unicorn India Ventures, SEA Fund, Devdatt Shah"
Camp K12,2021,2019.0,EdTech,Series A,141176.47,395013.1804600660,Gurugram,"Camp K12 is a global online school for 21st century skills, teaching Coding and other STEAM subjects to kids age 6-18 via LIVE, interactive, gamified online sessions","Matrix Partners India, Elevation Capital"
Elda Health,2021,2017.0,Healthcare,Seed,17647.06,67394.88832443200,Bengaluru,"Elda Health is a digital wellness platform that understands women intimately and offers a holistic wellness solution through physical, mental and social interventions.","Avaana Capital, Orios Ventures"
Sporjo,2021,2019.0,SportsTech,Pre-series A,23529.41,60027.528745579,Mumbai,A one stop destination to build a successful career in the Indian sports industry!,Punit Balan
Advantage Club,2021,2017.0,HRTech,Unknown,20000.0,75083.40547131200,Mumbai,"Advantage Club is India's largest employee engagement platform, Provide end to end employee benefit management with state of the art products like:","Y Combinator, Broom Ventures, Kunal Shah"
SuperGaming,2021,2018.0,Gaming,Series A,64705.88,235336.23446983900,Pune,"At SuperGaming, building India's best gaming company.","Skycatcher, AET Fund, BAce Capital, Dream Incubator, 1Up Ventures"
Ruptok,2021,2019.0,FinTech,Unknown,11764.71,29226.6948998878,New Delhi,"Ruptok fintech Pvt. Ltd. is an online gold loan service provider , with attractive interests rate .",Eclear Leasing
