Company Name,Year_Funded,Founded_in,Industry,Round/Series,Amount,Revenue,Location,About Company,Investors
IntelleWings,2021,2015.0,IT startup,Seed,1176.47,5648.504273148700,Panchkula,"IntelleWings develops Sanctions & Anti-money laundering solutions with a clear, concise, and fresh perspective.",Unknown
Shyplite,2021,2020.0,Logistics,Unknown,11764.71,43490.215442835400,New Delhi,Enable E-retailers to automate their logistics and increase efficiency in shipments by providing a single window shipping platform,N+1 Capital
Refyne,2021,2016.0,FinTech,Series A,235294.12,557321.1763076330,Bengaluru,Refyne partners with organisations to extend on-demand Earned Wage Access (EWA) to employees.,"DST Global, RTP Global"
Greenjoules,2021,2015.0,Renewable Energy,Series A,52941.18,230780.01790177800,Pune,Greenjoules is a green energy technology startup that specializes in making renewable biofuels.,Blue Ashva Capital
MentorKart,2021,2019.0,Consulting,Seed,1764.71,6696.3397692588300,New Delhi,MentorKart™ helps to fulfil dreams and take that big step towards success.,"Amit Singal, Manish Aggarwal"
Leverage Edu,2021,2017.0,EdTech,Debt,23529.41,60110.49668186820,New Delhi,AI-enabled marketplace designed to help students with their higher education and career growth plans,"Trifecta Capital Advisors, Blume Ventures"
Kale Logistics,2021,2015.0,Logistics,Series A,58823.53,204392.06735653800,Thane,Kale Logistics Solutions is a global IT solutions provider focused on providing cutting-edge technology solutions to the Logistics industry.,Inflexor Ventures
CustomerGlu,2021,2019.0,CRM,Unknown,3764.71,15482.03463339880,Bengaluru,CustomerGlu is a Low code Interactive Engagement platform to improve user stickiness.,"Kumar Aakash, Amit Singhal"
Cell Propulsion,2021,2019.0,EV startup,Unknown,23529.41,70409.77703817250,Bengaluru,Cell Propulsion is a fleet electrification company developing solutions for large scale electrification of commercial vehicle fleets.,growX ventures
Wellbeing Nutrition,2021,2017.0,HealthCare,Unknown,323398839173535.44,997115140201429.1,Mumbai,Organic whole food nutrition to keep up with the pace at which we live,Klub
Pee Safe,2021,2019.0,HealthCare,Pre-series B,35294.12,167491.15180990500,Gurugram,Redcliffe Hygiene Private Limited is India's fastest growing hygiene company.,"Shaival Desai, Alkemi Venture Partners"
Chqbook,2021,2019.0,FinTech,Unknown,11764.71,19516.412162369000,New Delhi,"Chqbook is a fintech startup that allows customers to explore, compare, book and get personal finance products.","Aavishkaar Venture Capital, YWC Venture Capital"
SimpliContract,2021,2016.0,Software,Seed,21176.47,98297.22485038960,Bengaluru,"SimpliContract is an Enterprise SaaS offering, focused on end to end Contract Life-cycle Management.",Kalaari Capital
Dropshop,2021,2019.0,Logistics,Pre-series A,11764.71,55594.72448710780,Bengaluru,Building technology to make distribution efficient and cheaper for large and small FMCG companies,Inflection Point Ventures
Jumbotail,2021,2021.0,E-commerce,Debt,47058.82,196500.7149605370,Bengaluru,Jumbotail is an operator of an online marketplace that simplifies food and grocery shopping.,Alteria Capital
BYJU'S,2021,2021.0,EdTech,Unknown,4117647.06,15935067.109961800,Bengaluru,BYJU'S is an educational technology company that develops personalized learning programs for K-12 students.,"Tiga Investments, Baron Capital"
Power Gummies,2021,2017.0,Nutrition,Unknown,11764.71,46480.31737940730,New Delhi,Power Gummies are a team of passionate givers who are dedicated to catering nutritional supplements,"Venture Catalysts, 9unicorns"
Convosight,2021,2019.0,SaaS startup,Series A,105882.35,429192.5261284250,New Delhi,A mission - to help community builders become community entrepreneurs.,Qualgro
Junio,2021,2018.0,FinTech,Seed,7058.82,22019.24870356920,New Delhi,Junio is a kids-focused digital pocket money-smart card.,"Amit Lakhotia, Pravin Jadhav"
Wherehouse.io,2021,2018.0,Logistics,Seed,323398839173535.44,1227439891594003.0,New Delhi,"Wherehouse.io is a supply chain intelligence company, helping brands to move closer to their customers enabling faster and better deliveries and accelerating business growth.",Better Capital
Flexmoney,2021,2019.0,FinTech,Series A,56470.59,245935.22708230100,Mumbai,"Flexmoney’s mission is to address the enormous digital credit market opportunity created by the disruption from e-commerce, EMI and BNPL checkout finance",Pravega Ventures
Fampay,2021,2018.0,FinTech,Series A,447058.82,775908.0107035100,Bengaluru,India's first numberless card and UPI without a bank account,"Greenoaks Capital, Elevation Capital"
Apna,2021,2011.0,Human Resources,Series B,823529.41,3250141.650996290,Bengaluru,India's Professional App - Apna is dedicated to solving the problem of unemployment at the grassroot level,"Sequoia Capital India, rocketship.vc"
XYXX Apparels,2021,2020.0,Fashion,Series A,47058.82,174887.52094273100,Surat,"XYXX Apparels,which runs an eponymous innerwear brand",Unknown
WaterScience,2021,2015.0,D2C startup,Unknown,323398839173535.44,523132128659140.75,Bengaluru,The aim of making good water affordable and accessible.,Unknown
BrowserStack,2021,2020.0,SaaS startup,Series B,2352941.18,7004621.633926460,Mumbai,BrowserStack is a leading software testing platform powering over two million tests every day across 15 global data centres.,Accel
Vital,2021,2020.0,Insuretech,Pre-series A,35294.12,162065.51449347700,New Delhi,"An affordable, digital health plan built around to cover both big and small expenses",BLinC Invest
Juicy chemistry,2021,2019.0,HealthCare,Unknown,323398839173535.44,493535651626536.8,Coimbatore,Juicy Chemistry operates as an eponymous consumer brand.,Spring Marketing Capital
Samaaro,2021,2020.0,SaaS startup,Unknown,1470.59,2938.3898260541900,Bengaluru,"Samaaro is a virtual event platform designed to help organizations host scalable, secure, and effective virtual events for a global audience","Chaitanya Kalipatnapu, Kedar Gavane"
Imagimake,2021,2014.0,Innovation management,Pre-series A,5882.35,15472.541143608400,Mumbai,An innovative play system to help children create their imagination,"Roha Investment Managers, angel investor Saumil Shah"
MSMEx,2021,2020.0,EdTech,Pre-series A,11764.71,39034.124803259500,Andheri,MSMEx connects micro and small Business Owners with curated Business Experts over live video.,"TNF Ventures, Razorpay"
RenewBuy,2021,2020.0,Insuretech,Series C,529411.76,1598574.0553049200,Gurugram,Simplest way to renew car insurance. Get quote and insure car in couple of minutes,"Lok Capital, IIFL Asset Management"
saarthi.ai,2021,2018.0,AI startup,Seed,323398839173535.44,649197497302028.2,Bengaluru,Multilingual Conversational Enterprise AI Platform for omnichannel automation of customer journeys in the user's native language.,Nvidia Inception
Kutumb,2021,2015.0,Community platform,Series A,305882.35,1094669.7080182400,Bengaluru,Kutumb is a social community enabler.,"Tiger Global Management, DST Global"
Superplum,2021,2011.0,AgriTech,Pre-series A,44705.88,137153.0012093230,Noida,Building India's most sophisticated platform for high quality fresh food,Marquee investors
Upside AI,2021,2015.0,FinTech,Seed,14117.65,31639.591153486200,Mumbai,Upside AI on the thesis that technology will make better investing decisions than humans over the long term.,Endiya Partners
PazCare,2021,2017.0,Insuretech,Unknown,323398839173535.44,1128999072602341.2,Bengaluru,Paz Care is India's leading Employee Benefits & Health insurance platform,"Ashish Hemrajani, Parikshit Dar"
Answer Genomics,2021,2016.0,HealthCare,Unknown,323398839173535.44,1560163226977956.2,Bengaluru,A healthcare company that uses genome-based data to help individuals make decisions.,"India Accelerator, Lyxel&Flamingo"
Skillmatics,2021,2020.0,EdTech,Series A,70588.24,264962.7877159360,Mumbai,Skillmatics develops learning games for pre-school and primary school kids aged under 10,Sequoia Capital India
Bimaplan,2021,2020.0,Insuretech,Pre-series A,29411.76,138350.33742734100,Bengaluru,Affordable insurance for the next billion Indians,"Roshan Abbas, Ritesh Malik"
Bueno Finance,2021,2021.0,FinTech,Seed,35294.12,93552.71057008700,Gurugram,"Bueno Gig Growth Technologies Pvt Ltd (""Bueno Finance"") is a financial services platform which aims is to help improve the financial health of customers.","Goat Capital, JAM Fund"
CityMall,2021,2019.0,E-commerce,Series B,258823.53,887696.4723639740,Gurugram,CityMall is a social e-commerce platform that sells lifestyle and curated products via peer-to-peer referrals on WhatsApp.,"General Catalyst, Jungle Ventures"
BYJU’S,2021,2020.0,EdTech,Unknown,588235.29,2331567.266198700,Bengaluru,BYJU'S is an educational technology company that develops personalized learning programs for K-12 students.,"Blackstone Group, ADQ"
India Quotient,2021,2019.0,Venture capitalist,Unknown,752941.18,3527033.857954810,Mumbai,India Quotient is a new type of early stage investor. We fund companies building disruptive businesses aimed at Indian consumers. We're,Unknown
The Switch Fix,2021,2015.0,HealthCare,Seed,323398839173535.44,863141395382042.4,Gurugram,The Switch Fix is a plant-based clean and conscious personal care brand for young urbans.,"Venture Catalysts, 9unicorns"
Anvidha Technologies,2021,2017.0,Tech Startup,Seed,17647.06,38399.67555432710,Haryana,Anvidha Technologies Private Limited is a HARYANA based private ltd.,Unknown
DigiSparsh,2021,2020.0,FinTech,Seed,323398839173535.44,764716626882105.2,Mumbai,DigiSparsh is India's first and only healthcare fintech platform which aims to make healthcare facilities accessible to everyone in the country.,GoAhead Ventures
CoffeeMug.ai,2021,2017.0,Networking,Pre-seed,7294.12,20507.98062311820,New Delhi,"A video first global platform of senior professionals, connecting 1:1, virtually or over coffee, building a powerful, long-lasting relationship.","Paradigm Shift Capital, AngelList India"
Pathfndr.io,2021,2015.0,SaaS startup,Pre-series A,323398839173535.44,678358777828877.1,Bengaluru,Intelligent Travel Tech Stack making sense of the world's information by scanning billions of data points and ranking destinations,Arali Ventures
BigLeap,2021,2014.0,Recruitment,Unknown,7058.82,33317.21131775600,Hyderabad,BigLeap Technologies & Solutions is focused on providing viable offshore consultancy services for enterprises looking to grow their business.,Anup Kumar Yama
Kazam,2021,2020.0,EV startup,Seed,10588.24,48757.025160892500,Bengaluru,"Kazam provides end to end Electric Vehicle charging solutions for Office Spaces, Apartments, Restaurants, Shops",Inflection Point Ventures
BimaPe,2021,2013.0,FinTech,Pre-seed,5882.35,27275.773007022200,Mumbai,BimaPe demystifies Insurance and its Management for individuals and families across India. 'BimaPe Bharosa Karo',"iSeed, Titan Capital"
MicroDegree,2021,2015.0,EdTech,Unknown,323398839173535.44,1466763112905798.5,Mangalore,MicroDegree is an ed-tech platform working towards democratising technology and job ready skills for Bharat.,Research Innovation Incubation Design Labs
Synapsica,2021,2019.0,HealthCare,Series A,47058.82,105095.86879080400,New Delhi,Artificial Intelligence tools to make quality diagnostic assessment available for all.,"IvyCap Ventures, Endiya Partners"
Kwik Foods,2021,2021.0,Food & Beverages,Seed,323398839173535.44,1059867853037851.4,Gurugram,Kwik Foods is one of the fastest-growing D2C fresh food brands that is disrupting the food industry,9Unicorns
Plutomen,2021,2019.0,AR startup,Unknown,3529.41,16287.292678693500,Ahmadabad,Plutomen Technologies Pvt Ltd founded in Nov 2016 is recognized start-up by DIPP in the field of Emerging Technology.,"GUSEC Seed Fund, DeVX Venture Fund"
GoMechanic,2021,2020.0,Automotive,Series C,494117.65,1610604.7684183300,Gurugram,"GoMechanic is India’s leading multi-brand car service company, committed to making the car servicing experience hassle-free & easy for everyone.","Tiger Global, Sequoia"
Grinntech,2021,2012.0,Automotive,Unknown,23529.41,116322.29515604200,Chennai,"Grinntech is an investor backed, growth phase start-up, leading on all front of battery design for EV applications.",Unknown
Nobel Hygiene,2021,2021.0,HealthCare,Unknown,705882.35,2585709.4226864900,Mumbai,"Nobel Hygiene is one of the leading disposable hygiene care products manufacturer in the country with an ISO 9001:2015 and CE certification, headquartered in Mumbai.",Quadria Capital
Green Cure,2021,2018.0,HealthCare,Pre-series A,323398839173535.44,1060621967185113.6,New Delhi,World's first company to combine German Engineering with Indian Ayurveda in health products,Venture Catalysts
Classplus,2021,2021.0,EdTech,Series C,764705.88,2030110.1951499500,Noida,Classplus was born out of an urge to redefine classroom engagement in this country.,Tiger Global
WINDO,2021,2019.0,E-commerce,Seed,5882.35,10518.198829189100,Hyderabad,Convert Instagram Page Into an Online Store in under 2-minutes. Create a free online store and automate your sales.,Unicorn India Ventures
ApnaKlub,2021,2021.0,E-commerce,Pre-series A,323398839173535.44,1112811401811464.8,Bengaluru,Supporting independent businesses and retail entrepreneurs with better than market wholesale prices and supply chain.,"Blume Ventures, Whiteboard Capital"
LegalPay,2021,2014.0,FinTech,Unknown,323398839173535.44,779175011077399.0,New Delhi,A tech focused B2B litigation finance company in India.,Ashwini Kakkar. 9Unicorns
Lavado,2021,2020.0,Consumer service,Unknown,323398839173535.44,801565963866078.5,Mumbai,A startup that is trying to permanently change the way people approach the cleaning and maintenance of their apparel and accessories.,Ashish Shah
Navars,2021,2021.0,EdTech,Unknown,323398839173535.44,877077933424859.9,Hyderabad,"Navars Edutech comprises dynamic mix of intellectual professionals, managerial team, Subject matter experts and Astronomy and Space researchers.",Faad Network
GoBolt,2021,2017.0,Logistics,Series B,235294.12,796043.998614751,Gurugram,"GoBOLT is a tech-logistics company operating in Line Haul & Short Haul Trucking, creating value through dis-intermediation, increased asset utilization and extensive use of technology.","Paragon Partners, Aavishkaar Capital"
Loco,2021,2020.0,Gaming,Seed,105882.35,443158.01284750100,Bengaluru,Loco is India's leading live game streaming app.,"Krafton, Lumikai"
Auric,2021,2016.0,HealthCare,Pre-series A,23529.41,35689.16799138290,New Delhi,Contemporary Beauty & Wellness Brand Based on Ayurveda,Venture Catalysts
Edmingle,2021,2011.0,EdTech,Unknown,3529.41,6204.267191094550,Bengaluru,Edmingle is a platform for all educators who want to launch their courses and sell them online.,"Indovation Fund, Mumbai Angels"
Slice,2021,2011.0,FinTech,Unknown,235294.12,577131.493695736,Bengaluru,"Slice is India's best credit card challenger to pay bills, manage expenses, and unlock rewards.","Gunosy, Blume Ventures"
Humit,2021,2020.0,Music,Pre-seed,323398839173535.44,1522461385427796.2,Bengaluru,Humit is a social networking app for music sharing and discovery.,Antler India
Airblack,2021,2021.0,IT startup,Series A,61176.47,164886.68721245600,Gurugram,Airblack is on a mission to help people convert their passion to a livelihood.,"Edge Ventures, Elevation Capital"
NIRAMAI,2021,2013.0,HealthCare,Unknown,323398839173535.44,1455889073159412.2,Bengaluru,"NIRAMAI has developed a novel breast cancer screening solution that uses Thermalytix, i.e. machine intelligence over thermography images.",CDC Group
Intervue,2021,2019.0,SaaS startup,Seed,323398839173535.44,792915628130707.1,New Delhi,World's fastest collaborative environment to take tech interviews.,"Titan Capital, Kunal Shah"
Nestroots,2021,2017.0,Fashion,Seed,1176.47,4383.0622639354800,Gurugram,"Ottoman, Stool, Brass Kitchen Solutions, Masala Box, Roti Box, Bar Accessories and Many Gifting Options at Nestroots.",We Founder Circle
Detect Technologies,2021,2016.0,Automation,Unknown,141176.47,626194.3929437660,Chennai,Detect Technologies is a leading Industrial AI company that is building innovative solutions and cutting-edge technology for the industrial ecosystem.,"Accel Partners, Elevation Capital"
CredR,2021,2021.0,Automotive,Unknown,76470.59,347301.20661858300,Bengaluru,CredR is India’s Most Trusted Used Two-Wheeler Consumer Brand that leverages Technology & Processes to simplify the Used Two-wheeler Market.,"Yamaha Motors, Omidyar Network India, Eight Roads Ventures"
Fourth Partner Energy,2021,2021.0,Solar,Unknown,1470588.24,6032259.008279120,Hyderabad,"Fourth Partner Energy is India’s leading distributed solar energy firm focusing on building and financing solar projects across the private and public sectors for commercial, industrial and institutional entities.","Norfund, The Rise Fund"
TABLT,2021,2021.0,HealthCare,Seies A,35294.12,152026.17804389100,Kolkata,TABLT [Previously Sabse Sasta Dukaan] is one of India's most trusted online pharmacy dealing in medicines and other healthcare products.,Siti Cable
Hesa,2021,2015.0,IT startup,Seed,23529.41,39726.46435993980,Hyderabad,HESA is connecting Bharat with India and India with Bharat Phygitally. We are bridging the gap for the world’s largest customer base that resides in rural India.,"Venture Catalysts, 9unicorns"
Powerhouse91,2021,2009.0,Consumer goods,Seed,323398839173535.44,1534333405090412.5,Gurugram,"A tech-driven company that acquires, operates, and scales outstanding ecommerce brands in India.",Crossbeam Venture Partners
Nalanda Learning,2021,2020.0,EdTech,Unknown,58823.53,254972.57778336000,Kolkata,India's 1st Online Preschool with Blended Learning Model,Aavishkaar Capital
Chargeup,2021,2020.0,Renewable Energy,Pre-series A,323398839173535.44,720965079557102.5,New Delhi,"""Battery as a Service"" for 3 wheeler & 2 wheelers",Mapmyindia
Knackit,2021,2020.0,IT startup,Unknown,1176.47,1772.943000264700,Bengaluru,Knackit is a talent sharing platform where users can showcase and monetize their artistry.,Jyoti Bansal
Treebo Hotels,2021,2019.0,Hospitality,Series D,188235.29,768083.7714243440,Bengaluru,Treebo Hotels is India's most loved hotel chain in the premium-budget segment.,Accor
Raptee Energy,2021,2006.0,Automotive,Unknown,8235.29,32651.060358357400,Chennai,Raptee Energy Inc. is looking to accelerate the transition to smart and sustainable mobility!,Unknown
Meddo,2021,2019.0,HealthCare,Unknown,70588.24,349902.23244903200,Gurugram,Meddo (Arctern Healthcare) are re-defining how primary and secondary healthcare is provided in India through a connected care delivery platform.,"SRI Capital, Picus Capital, Alkemi Capital"
Supertails,2021,2019.0,Pet care,Pre-series A,30588.24,149388.52064684800,Bengaluru,Supertails is building a digital pet care platform which offers expert led healthcare services and products.,"Saama Capital, DSG Consumer Partners"
SkilloVilla,2021,2015.0,EdTech,Seed,3529.41,6422.056740938160,Bengaluru,Mission to support young graduates in enhancing their learnings and transform them into big earnings.,Titan Capital
Cancer Clinics,2021,2021.0,HealthCare,Pre-series A,17647.06,36202.88098001950,Telugana,"Cancer Helpline is a source of information and support, helping with all the things that people affected by cancer want and need.",Axilor
Velocity,2021,2021.0,FinTech,Seed,15294.12,43416.687248484500,Bengaluru,Velocity provides revenue-based-financing to online businesses. It aims to build the future of banking and financial services for new age businesses in India.,Valar Ventures
Happy Jars,2021,2021.0,Food & Beverages,Seed,4705.88,7217.162133117830,New Delhi,"Manufacture and retail a delicious range of all-natural nut butters, made without oil, sugar or preservatives.",Inflection Point Ventures
Inshorts,2021,2019.0,Media,Unknown,470588.24,2269698.731915830,Noida,Inshorts is a news aggregator application that collects and summarizes news based on user behavior and preferences.,"Addition, SIG Global India Fund"
ExtraaEdge,2021,2017.0,MarTech,Pre-series A,11764.71,54884.04543615820,Pune,Data Science powered - Admission & Marketing CRM Automation for Education Enrolments,"9Unicorns Accelerator Fund, Indian Angel Network"
Zotalabs,2021,2015.0,Tech Startup,Seed,14705.88,59679.7560083244,Pune,Zotalabs gives the power of Emerging Technology to your digital automation with our easy to use APIs.,Alfa Ventures
Voiro,2021,2014.0,Advertisement,Pre-series A,21176.47,63080.31410712910,Bengaluru,Voiro is the first all-in-one revenue management suite exclusively for ad-led digital publishers across media.,1Crowd
Dream Sports,2021,2017.0,Gaming,Unknown,4705882.35,19468513.807181000,Mumbai,"Dream Sports is India’s leading sports technology company with brands such as Dream11, FanCode, DreamX and DreamSetGo in its portfolio.","TCV, D1 Capital Partners, Falcon Edge."
Safex Chemicals,2021,2014.0,AgriTech,Unknown,588235.29,1894109.8379469900,New Delhi,Safex Chemicals India Ltd is a leading company having a strong foothold in the Indian agrochemicals industry.,BanyanTree Finance Pvt. Ltd.
Instoried,2021,2018.0,Content creation,Unknown,323398839173535.44,615121828221561.1,Bengaluru,Instoried is an augmented writing platform which improves customer interest and engagement.,"EXPERT DOJO, Mumbai Angels"
Rupifi,2021,2020.0,FinTech,Pre-series A,48235.29,120846.18392613000,Bengaluru,Rupifi operates a software-as-a-service (SaaS) firm focussed on financial products.,Quona Capital
Moneyboxx,2021,2015.0,FinTech,Debt,35294.12,96240.87793355460,Mumbai,Moneyboxx Finance provides easy access to financing to the deserving micro enterprises.,"Ashv Finance, BlackSoil Capital"
CityMall,2021,2020.0,E-commerce,Series A,129411.76,311877.5577410710,Gurugram,CityMall is a social e-commerce platform that sells lifestyle and curated products via peer-to-peer referrals on WhatsApp.,"WaterBridge Ventures, SAIF Partners"
Janani,2021,2019.0,Heathcare,Seed,11764.71,19865.760116568200,Bengaluru,Janani.ai is a fertility care provider.,"Sweta Rau, 9Unicorns Accelerator Fund"
ReshaMandi,2021,2019.0,AgriTech,Seed,20000.0,86181.21680261030,Bengaluru,India's 1st award winning technology led digital ecosystem for Silk,"Omnivore, Strive Ventures"
Bombay Shaving Company,2021,2008.0,Lifestyle,Unknown,23529.41,86919.40200147830,New Delhi,"Bombay Shaving Company is a consumer goods company that focuses on developing a range of shave care, beard care, and skincare products.","Rajesh Sud, KULDEEP JAIN"
DotPe,2021,2015.0,FinTech,Series A,317647.06,806675.5886034350,Gurugram,DotPe is a technology start-up providing a commerce and payments platform to offline enterprise businesses.,"PayU, Google"
Homingos,2021,2014.0,Augmented reality,Unknown,323398839173535.44,1384451198956438.2,Bengaluru,Homingos is an Augmented reality (AR)-based social networking platform.,"Sundi Natarajan, Srinivas Anumolu"
Anar Business Community,2021,2015.0,Tech Startup,Unknown,323398839173535.44,1330772696327744.0,Mumbai,Anar is a communications and networking platform for businesses around the world.,"Titan Capital, First Cheque"
Five Star Finance,2021,2020.0,FinTech,Unknown,2752941.18,6406381.67283512,Chennai,Five-Star is a Registered Non Banking Finance Company (NBFC) with Reserve Bank of India (RBI).,"TPG Capital Asia, Epiq Capital"
Settlrs,2021,2016.0,Rental space,Pre-series A,323398839173535.44,865352864755334.8,Bengaluru,"A B2B rental services company for furniture, home appliances, electronic and IT infrastructure.",MaGEHold Pte. Ltd.
BYJU'S,2021,2014.0,EdTech,Series F,5411764.71,10584509.18722040,Bengaluru,BYJU'S is an educational technology company that develops personalized learning programs for K-12 students.,"BlackRock, Owl Ventures"
Annapurna Finance,2021,2020.0,FinTech,Unknown,352941.18,1211874.938090260,Bhubaneswar,Annapurna Microfinance is a microfinance venture that works for the financial and economic upliftment of underserved and unreached women.,"Asian Development Bank, Oman India Joint Investment Fund"
HealthPlix,2021,2019.0,HealthCare,Series B,158823.53,361532.8673044920,Bengaluru,HealthPlix is a healthtech startup,"JSW Ventures, Kalaari Capital"
Masai School,2021,2020.0,EdTech,Series A,58823.53,158484.34535383300,Bengaluru,Masai School is a job-oriented software training services.,"Unitus Ventures, Omidyar Network India"
Bewakoof,2021,2016.0,D2C Fashion,Unknown,47058.82,213754.76459035600,Mumbai,"Society perceives Bewakoof as stupid.But what does society call Bewakoof?Often, it’s anything different or anything that’s done differently.","IvyCap Ventures, Pratithi Investment Trust"
IndiaLends,2021,2020.0,FinTech,Unknown,60000.0,106393.65084435700,New Delhi,IndiaLends is a digital lending and borrowing marketplace.,"ACPI Investments, AdvantEdge Founders"
Stelis Biopharma,2021,2020.0,BioTechnology,Series B,2294117.65,9027181.607442870,Bengaluru,Stelis Biopharma is a vertically integrated biopharmaceutical company.,"RouteOne, Mankekar Family Office"
Tilt,2021,2017.0,Bike Rental,Unknown,1470.59,6013.963502495530,Bengaluru,A bike-share for Indian campuses,Y Combinator
NeoDove,2021,2008.0,AI startup,Seed,176470.59,878768.9861185550,Jaipur,"Neodove is an AI-powered, end to end tech-enabled customer communication and reporting solution.",India Quotient
Zaara Biotech,2021,2016.0,BioTechnology,Unknown,117647.06,220904.43942587000,Kottayam,India's First Algal-seaweed Biotechnology Students' Startup in collaboration with ICAR- Central Institute of fisheries and Technology,TCN International Commerce
KreditBee,2021,2011.0,FinTech,Seed,882352.94,1948676.928393600,Bengaluru,KreditBee is a digital lending platform developed to assist young professionals with their personal finances.,"Alpine Capital, PremjiInvest"
True Balance,2021,2021.0,FinTech,Debt,117647.06,359438.1304798830,Gurugram,True Balance is a digital wallet that enables users to access utility bill payment and other financial products.,"Bon Angels Venture Partners, Daesung Private Equity"
